id,type,name,symbol,category,currency,max_scale,run,data_source
2605,conceptual_asset,FONDO MUTUO SECURITY VISIÓN GLOBAL,FFMM-ADMINISTRADORA-8351,mutual_fund,,4,8351-8,http://www.cmfchile.cl
2097,conceptual_asset,FONDO MUTUO BANCOESTADO AHORRO BALANCEADO,FFMM-BANCOESTADO-9147,mutual_fund,,4,9147-2,http://www.cmfchile.cl
2098,conceptual_asset,FONDO MUTUO BANCOESTADO AHORRO GARANTIZADO 1,FFMM-BANCOESTADO-8512,mutual_fund,,4,8512-k,http://www.cmfchile.cl
2099,conceptual_asset,FONDO MUTUO BANCOESTADO AHORRO MEDIANO Y LARGO PLAZO,FFMM-BANCOESTADO-9148,mutual_fund,,4,9148-0,http://www.cmfchile.cl
2100,conceptual_asset,FONDO MUTUO BANCOESTADO BNP PARIBAS ACCIONES EMERGENTES,FFMM-BANCOESTADO-8745,mutual_fund,,4,8745-9,http://www.cmfchile.cl
2102,conceptual_asset,FONDO MUTUO BANCOESTADO EMPRESAS EUROPEAS,FFMM-BANCOESTADO-9210,mutual_fund,,4,9210-k,http://www.cmfchile.cl
2103,conceptual_asset,FONDO MUTUO BANCOESTADO GARANTIZADO DOBLE OPORTUNIDAD,FFMM-BANCOESTADO-8746,mutual_fund,,4,8746-7,http://www.cmfchile.cl
2104,conceptual_asset,FONDO MUTUO BANCOESTADO GARANTIZADO NUEVO MUNDO,FFMM-BANCOESTADO-8611,mutual_fund,,4,8611-8,http://www.cmfchile.cl
2105,conceptual_asset,FONDO MUTUO BANCOESTADO GARANTIZADO TESORO AMERICANO,FFMM-BANCOESTADO-8646,mutual_fund,,4,8646-0,http://www.cmfchile.cl
2106,conceptual_asset,FONDO MUTUO BANCOESTADO PERLAS EMERGENTES GARANTIZADO,FFMM-BANCOESTADO-8614,mutual_fund,,4,8614-2,http://www.cmfchile.cl
1622,conceptual_asset,FONDO MUTUO BANCOESTADO BNP PARIBAS ACCIONES DESARROLLADAS,FFMM-BANCOESTADO-8744,mutual_fund,CLP,4,8744-0,http://www.cmfchile.cl
2287,conceptual_asset,FONDO MUTUO CORPORATIVO BANCOESTADO,FFMM-BANCOESTADO-8318,mutual_fund,,4,8318-6,http://www.cmfchile.cl
2366,conceptual_asset,FONDO MUTUO ITAU DEUDA CHILENA,FFMM-ITAU-8954,mutual_fund,,4,8954-0,http://www.cmfchile.cl
2367,conceptual_asset,FONDO MUTUO ITAU DEUDA CORTO PLAZO,FFMM-ITAU-8285,mutual_fund,,4,8285-6,http://www.cmfchile.cl
2368,conceptual_asset,FONDO MUTUO ITAU DEUDA LATAM,FFMM-ITAU-9029,mutual_fund,,4,9029-8,http://www.cmfchile.cl
2107,conceptual_asset,FONDO MUTUO BANDA DÓLAR GARANTIZADO,FFMM-BANCHILE-8693,mutual_fund,,4,8693-2,http://www.cmfchile.cl
2108,conceptual_asset,FONDO MUTUO BANDA ESTADOS UNIDOS GARANTIZADO,FFMM-BANCHILE-8719,mutual_fund,,4,8719-k,http://www.cmfchile.cl
2109,conceptual_asset,FONDO MUTUO BANDA EUROPA GARANTIZADO,FFMM-BANCHILE-8720,mutual_fund,,4,8720-3,http://www.cmfchile.cl
2213,conceptual_asset,FONDO MUTUO BONSAI 106 GARANTIZADO,FFMM-BANCHILE-8335,mutual_fund,,4,8335-6,http://www.cmfchile.cl
1720,conceptual_asset,FONDO MUTUO BOOSTER ACCIONES BRASIL II,FFMM-BANCHILE-9714,mutual_fund,,4,9714-4,http://www.cmfchile.cl
2216,conceptual_asset,FONDO MUTUO BOOSTER ACCIONES EUROPA,FFMM-BANCHILE-9286,mutual_fund,,4,9286-k,http://www.cmfchile.cl
2101,conceptual_asset,FONDO MUTUO BANCOESTADO BNP PARIBAS RENTA DESARROLLADA,FFMM-BANCOESTADO-8754,mutual_fund,CLP,4,8754-8,http://www.cmfchile.cl
1724,conceptual_asset,FONDO MUTUO BOOSTER ACCIONES JAPÓN II,FFMM-BANCHILE-9547,mutual_fund,CLP,4,9547-8,http://www.cmfchile.cl
1781,conceptual_asset,FONDO MUTUO BANCHILE DEPÓSITO XXI,FFMM-BANCHILE-8152,mutual_fund,CLP,4,8152-3,http://www.cmfchile.cl
1782,conceptual_asset,FONDO MUTUO BANCHILE DEUDA DÓLAR,FFMM-BANCHILE-8957,mutual_fund,USD,4,8957-5,http://www.cmfchile.cl
1783,conceptual_asset,FONDO MUTUO BANCHILE DEUDA SOBERANA,FFMM-BANCHILE-8934,mutual_fund,CLP,4,8934-6,http://www.cmfchile.cl
1784,conceptual_asset,FONDO MUTUO BANCHILE DISPONIBLE,FFMM-BANCHILE-8052,mutual_fund,CLP,4,8052-7,http://www.cmfchile.cl
2218,conceptual_asset,FONDO MUTUO BOOSTER ACCIONES JAPÓN,FFMM-BANCHILE-9321,mutual_fund,,4,9321-1,http://www.cmfchile.cl
2219,conceptual_asset,FONDO MUTUO BOOSTER ASIA EMERGENTE,FFMM-BANCHILE-9047,mutual_fund,,4,9047-6,http://www.cmfchile.cl
2220,conceptual_asset,FONDO MUTUO BOOSTER AUSTRALIA,FFMM-BANCHILE-8869,mutual_fund,,4,8869-2,http://www.cmfchile.cl
2222,conceptual_asset,FONDO MUTUO BOOSTER CHILE,FFMM-BANCHILE-8909,mutual_fund,,4,8909-5,http://www.cmfchile.cl
2223,conceptual_asset,FONDO MUTUO BOOSTER CHINA,FFMM-BANCHILE-8752,mutual_fund,,4,8752-1,http://www.cmfchile.cl
2224,conceptual_asset,FONDO MUTUO BOOSTER CHINA STOCKS,FFMM-BANCHILE-8985,mutual_fund,,4,8985-0,http://www.cmfchile.cl
2225,conceptual_asset,FONDO MUTUO BOOSTER CHINA STOCKS II,FFMM-BANCHILE-9083,mutual_fund,,4,9083-2,http://www.cmfchile.cl
2226,conceptual_asset,FONDO MUTUO BOOSTER EUROPA,FFMM-BANCHILE-8972,mutual_fund,,4,8972-9,http://www.cmfchile.cl
2227,conceptual_asset,FONDO MUTUO BOOSTER EUROPA II,FFMM-BANCHILE-9070,mutual_fund,,4,9070-0,http://www.cmfchile.cl
2228,conceptual_asset,FONDO MUTUO BOOSTER JAPON,FFMM-BANCHILE-9059,mutual_fund,,4,9059-k,http://www.cmfchile.cl
1614,conceptual_asset,FONDO MUTUO AHORRO,FFMM-BANCHILE-8035,mutual_fund,,4,8035-7,http://www.cmfchile.cl
2229,conceptual_asset,FONDO MUTUO BOOSTER REAL ESTATE EUROPE,FFMM-BANCHILE-9234,mutual_fund,,4,9234-7,http://www.cmfchile.cl
2230,conceptual_asset,FONDO MUTUO BOOSTER REAL ESTATE USA,FFMM-BANCHILE-8973,mutual_fund,,4,8973-7,http://www.cmfchile.cl
2231,conceptual_asset,FONDO MUTUO BOOSTER SMALL CAP USA,FFMM-BANCHILE-8866,mutual_fund,,4,8866-8,http://www.cmfchile.cl
2232,conceptual_asset,FONDO MUTUO BOOSTER USA PESOS,FFMM-BANCHILE-9218,mutual_fund,,4,9218-5,http://www.cmfchile.cl
2234,conceptual_asset,FONDO MUTUO BRIC ACCIONARIO,FFMM-BANCHILE-8830,mutual_fund,,4,8830-7,http://www.cmfchile.cl
2235,conceptual_asset,FONDO MUTUO BRICS GARANTIZADO,FFMM-BANCHILE-8415,mutual_fund,,4,8415-8,http://www.cmfchile.cl
2243,conceptual_asset,FONDO MUTUO CASH,FFMM-BANCHILE-8121,mutual_fund,,4,8121-3,http://www.cmfchile.cl
2787,conceptual_asset,FONDO DE INVERSIÓN BANCHILE ORO,FINV-9837,investment_fund,,4,9837-k,http://www.cmfchile.cl
2751,conceptual_asset,FONDO MUTUO BEST COUPON EUROPE,FFMM-BANCHILE-9864,mutual_fund,,4,9864-7,http://www.cmfchile.cl
2255,conceptual_asset,FONDO MUTUO CHILE ACCIONARIO,FFMM-BANCHILE-8027,mutual_fund,,4,8027-6,http://www.cmfchile.cl
1787,conceptual_asset,FONDO MUTUO BANCHILE ESTRATEGIA AGRESIVA,FFMM-BANCHILE-9042,mutual_fund,CLP,4,9042-5,http://www.cmfchile.cl
1788,conceptual_asset,FONDO MUTUO BANCHILE ESTRATEGIA CONSERVADORA,FFMM-BANCHILE-9041,mutual_fund,CLP,4,9041-7,http://www.cmfchile.cl
1496,conceptual_asset,FONDO DE INVERSION BANCHILE LATAM EQUITY,FINV-7195,investment_fund,,4,7195-1,http://www.cmfchile.cl
2256,conceptual_asset,FONDO MUTUO CHILE BURSATIL GARANTIZADO,FFMM-BANCHILE-8964,mutual_fund,,4,8964-8,http://www.cmfchile.cl
1768,conceptual_asset,FONDO MUTUO BANCHILE RENTA CORTO PLAZO,FFMM-BANCHILE-8274,mutual_fund,CLP,4,8274-0,http://www.cmfchile.cl
2456,conceptual_asset,FONDO MUTUO OPPORTUNITY 100 GARANTIZADO,FFMM-ADMINISTRADORA-8362,mutual_fund,,4,8362-3,http://www.cmfchile.cl
1745,conceptual_asset,FONDO MUTUO BANCHILE CAPITAL EFECTIVO,FFMM-BANCHILE-8931,mutual_fund,CLP,4,8931-1,http://www.cmfchile.cl
1618,conceptual_asset,FONDO MUTUO BANCHILE ESTRATEGICO,FFMM-BANCHILE-8125,mutual_fund,CLP,4,8125-6,http://www.cmfchile.cl
1831,conceptual_asset,FONDO MUTUO BANCHILE INVERSIÓN BRASIL,FFMM-BANCHILE-8533,mutual_fund,CLP,4,8533-2,http://www.cmfchile.cl
1832,conceptual_asset,FONDO MUTUO BANCHILE INVERSIÓN CHINA,FFMM-BANCHILE-8534,mutual_fund,CLP,4,8534-0,http://www.cmfchile.cl
1833,conceptual_asset,FONDO MUTUO BANCHILE INVERSIÓN USA,FFMM-BANCHILE-8078,mutual_fund,CLP,4,8078-0,http://www.cmfchile.cl
1879,conceptual_asset,FONDO MUTUO BANCHILE LATAM ACCIONARIO,FFMM-BANCHILE-8811,mutual_fund,CLP,4,8811-0,http://www.cmfchile.cl
1883,conceptual_asset,FONDO MUTUO BANCHILE PORTAFOLIO ACTIVO AGRESIVO,FFMM-BANCHILE-8555,mutual_fund,CLP,4,8555-3,http://www.cmfchile.cl
1884,conceptual_asset,FONDO MUTUO BANCHILE PORTAFOLIO ACTIVO CONSERVADOR,FFMM-BANCHILE-8377,mutual_fund,CLP,4,8377-1,http://www.cmfchile.cl
2741,conceptual_asset,FONDO MUTUO BOOSTER ACCIONES BRASIL III,FFMM-BANCHILE-9839,mutual_fund,,4,9839-6,http://www.cmfchile.cl
1855,conceptual_asset,FONDO MUTUO BANCHILE JAPÓN ACCIONARIO,FFMM-BANCHILE-9255,mutual_fund,,4,9255-k,http://www.cmfchile.cl
1880,conceptual_asset,FONDO MUTUO BANCHILE LATAM CORPORATE INVESTMENT GRADE,FFMM-BANCHILE-8249,mutual_fund,,4,8249-k,http://www.cmfchile.cl
1881,conceptual_asset,FONDO MUTUO BANCHILE LIQUIDEZ,FFMM-BANCHILE-8115,mutual_fund,CLP,4,8115-9,http://www.cmfchile.cl
2263,conceptual_asset,FONDO MUTUO CONSUMO ESTABLE,FFMM-BANCHILE-8554,mutual_fund,,4,8554-5,http://www.cmfchile.cl
2286,conceptual_asset,FONDO MUTUO CORPORATIVO,FFMM-BANCHILE-8094,mutual_fund,,4,8094-2,http://www.cmfchile.cl
2289,conceptual_asset,FONDO MUTUO DE CRECIMIENTO,FFMM-BANCHILE-8014,mutual_fund,,4,8014-4,http://www.cmfchile.cl
2290,conceptual_asset,FONDO MUTUO DE LIQUIDEZ,FFMM-BANCHILE-8017,mutual_fund,,4,8017-9,http://www.cmfchile.cl
2291,conceptual_asset,FONDO MUTUO DECISIÓN ESTRATÉGICA,FFMM-BANCHILE-8356,mutual_fund,,4,8356-9,http://www.cmfchile.cl
2293,conceptual_asset,FONDO MUTUO DEPOSITO PLUS II GARANTIZADO,FFMM-BANCHILE-9050,mutual_fund,,4,9050-6,http://www.cmfchile.cl
2292,conceptual_asset,FONDO MUTUO DEPOSITO PLUS II GARANTIZADO,FFMM-BANCHILE-8965,mutual_fund,,4,8965-6,http://www.cmfchile.cl
2294,conceptual_asset,FONDO MUTUO DEPOSITO PLUS III GARANTIZADO,FFMM-BANCHILE-9051,mutual_fund,,4,9051-4,http://www.cmfchile.cl
2295,conceptual_asset,FONDO MUTUO DEPOSITO PLUS III GARANTIZADO,FFMM-BANCHILE-8969,mutual_fund,,4,8969-9,http://www.cmfchile.cl
2297,conceptual_asset,FONDO MUTUO DEPOSITO PLUS IV GARANTIZADO,FFMM-BANCHILE-8984,mutual_fund,,4,8984-2,http://www.cmfchile.cl
2296,conceptual_asset,FONDO MUTUO DEPOSITO PLUS IV GARANTIZADO,FFMM-BANCHILE-9052,mutual_fund,,4,9052-2,http://www.cmfchile.cl
2298,conceptual_asset,FONDO MUTUO DEPOSITO PLUS V GARANTIZADO,FFMM-BANCHILE-9046,mutual_fund,,4,9046-8,http://www.cmfchile.cl
2273,conceptual_asset,FONDO MUTUO CORP EMEA,FFMM-CORPBANCA-8794,mutual_fund,,4,8794-7,http://www.cmfchile.cl
2274,conceptual_asset,FONDO MUTUO CORP FINANCIAL BANKING,FFMM-CORPBANCA-8268,mutual_fund,,4,8268-6,http://www.cmfchile.cl
2275,conceptual_asset,FONDO MUTUO CORP GARANTIZADO LA NUEVA POTENCIA,FFMM-CORPBANCA-8630,mutual_fund,,4,8630-4,http://www.cmfchile.cl
2299,conceptual_asset,FONDO MUTUO DEPOSITO PLUS V GARANTIZADO,FFMM-BANCHILE-9053,mutual_fund,,4,9053-0,http://www.cmfchile.cl
2319,conceptual_asset,FONDO MUTUO EUROAMERICA SELECCIÓN CHILENA,FFMM-ZURICH-9044,mutual_fund,,4,9044-1,http://www.cmfchile.cl
2566,conceptual_asset,FONDO MUTUO SECURITY ASIATICO,FFMM-ADMINISTRADORA-8613,mutual_fund,,4,8613-4,http://www.cmfchile.cl
2567,conceptual_asset,FONDO MUTUO SECURITY BONOS LATINOAMERICANOS,FFMM-ADMINISTRADORA-8260,mutual_fund,,4,8260-0,http://www.cmfchile.cl
2568,conceptual_asset,FONDO MUTUO SECURITY BRASIL,FFMM-ADMINISTRADORA-8612,mutual_fund,,4,8612-6,http://www.cmfchile.cl
2569,conceptual_asset,FONDO MUTUO SECURITY CHILE 105 GARANTIZADO,FFMM-ADMINISTRADORA-8632,mutual_fund,,4,8632-0,http://www.cmfchile.cl
2570,conceptual_asset,FONDO MUTUO SECURITY CHILE LONG-SHORT,FFMM-ADMINISTRADORA-8756,mutual_fund,,4,8756-4,http://www.cmfchile.cl
2571,conceptual_asset,FONDO MUTUO SECURITY CONFIANZA,FFMM-ADMINISTRADORA-8463,mutual_fund,,4,8463-8,http://www.cmfchile.cl
2572,conceptual_asset,FONDO MUTUO SECURITY CONFIANZA DÓLAR,FFMM-ADMINISTRADORA-8664,mutual_fund,,4,8664-9,http://www.cmfchile.cl
2300,conceptual_asset,FONDO MUTUO DEPOSITO PLUS VI GARANTIZADO,FFMM-BANCHILE-9058,mutual_fund,,4,9058-1,http://www.cmfchile.cl
2301,conceptual_asset,FONDO MUTUO DEPÃ¿SITO PLUS GARANTIZADO,FFMM-BANCHILE-9049,mutual_fund,,4,9049-2,http://www.cmfchile.cl
2302,conceptual_asset,FONDO MUTUO DEPÓSITO PLUS GARANTIZADO,FFMM-BANCHILE-8947,mutual_fund,,4,8947-8,http://www.cmfchile.cl
2303,conceptual_asset,FONDO MUTUO DEPÓSITO PLUS VII,FFMM-BANCHILE-9319,mutual_fund,,4,9319-k,http://www.cmfchile.cl
2304,conceptual_asset,FONDO MUTUO DEUDA CORPORATIVA DÓLAR,FFMM-BANCHILE-8264,mutual_fund,,4,8264-3,http://www.cmfchile.cl
2309,conceptual_asset,FONDO MUTUO ECONOMIAS EMERGENTES,FFMM-BANCHILE-8128,mutual_fund,,4,8128-0,http://www.cmfchile.cl
2310,conceptual_asset,FONDO MUTUO ESTRATEGIA COMMODITIES GARANTIZADO,FFMM-BANCHILE-8761,mutual_fund,,4,8761-0,http://www.cmfchile.cl
2311,conceptual_asset,FONDO MUTUO ESTRUCTURADO BONOS UF PLUS I,FFMM-BANCHILE-9400,mutual_fund,,4,9400-5,http://www.cmfchile.cl
1790,conceptual_asset,FONDO MUTUO ESTRUCTURADO BONOS UF PLUS II,FFMM-BANCHILE-9484,mutual_fund,,4,9484-6,http://www.cmfchile.cl
2312,conceptual_asset,FONDO MUTUO ESTRUCTURADO EUROPA DESARROLLADA NIVEL 100,FFMM-BANCHILE-9205,mutual_fund,,4,9205-3,http://www.cmfchile.cl
2313,conceptual_asset,FONDO MUTUO ESTRUCTURADO EUROPA DESARROLLADA NIVEL 90,FFMM-BANCHILE-9206,mutual_fund,,4,9206-1,http://www.cmfchile.cl
2314,conceptual_asset,FONDO MUTUO ESTRUCTURADO JAPÓN NIVEL 100,FFMM-BANCHILE-9232,mutual_fund,,4,9232-0,http://www.cmfchile.cl
2315,conceptual_asset,FONDO MUTUO ESTRUCTURADO SMALL - MID CAP USA NIVEL 90,FFMM-BANCHILE-9233,mutual_fund,,4,9233-9,http://www.cmfchile.cl
2316,conceptual_asset,FONDO MUTUO EURO MONEY MARKET,FFMM-BANCHILE-8272,mutual_fund,,4,8272-4,http://www.cmfchile.cl
2317,conceptual_asset,FONDO MUTUO EURO TECHNOLOGY FUND,FFMM-BANCHILE-8153,mutual_fund,,4,8153-1,http://www.cmfchile.cl
2325,conceptual_asset,FONDO MUTUO EUROPA ACCIONARIO GARANTIZADO,FFMM-BANCHILE-8951,mutual_fund,,4,8951-6,http://www.cmfchile.cl
2326,conceptual_asset,FONDO MUTUO EUROPEO ESTRUCTURADO NIVEL 90,FFMM-BANCHILE-9330,mutual_fund,,4,9330-0,http://www.cmfchile.cl
2327,conceptual_asset,FONDO MUTUO FINANCIERO,FFMM-BANCHILE-8556,mutual_fund,,4,8556-1,http://www.cmfchile.cl
2328,conceptual_asset,FONDO MUTUO FLEXIBLE,FFMM-BANCHILE-8025,mutual_fund,,4,8025-k,http://www.cmfchile.cl
2007,conceptual_asset,FONDO MUTUO SECURITY CHECK,FFMM-ADMINISTRADORA-8048,mutual_fund,CLP,4,8048-9,http://www.cmfchile.cl
2329,conceptual_asset,FONDO MUTUO FORTALEZAS GARANTIZADO,FFMM-BANCHILE-8595,mutual_fund,,4,8595-2,http://www.cmfchile.cl
2330,conceptual_asset,FONDO MUTUO FRONTERAS DEL ESTE GARANTIZADO,FFMM-BANCHILE-8472,mutual_fund,,4,8472-7,http://www.cmfchile.cl
2333,conceptual_asset,FONDO MUTUO GIGANTES GARANTIZADO,FFMM-BANCHILE-8510,mutual_fund,,4,8510-3,http://www.cmfchile.cl
2336,conceptual_asset,FONDO MUTUO GLOBAL STOCKS GARANTIZADO,FFMM-BANCHILE-9001,mutual_fund,,4,9001-8,http://www.cmfchile.cl
2345,conceptual_asset,FONDO MUTUO INDUSTRIA Y CONSUMO CÍCLICO,FFMM-BANCHILE-8557,mutual_fund,,4,8557-k,http://www.cmfchile.cl
2350,conceptual_asset,FONDO MUTUO INTERNATIONAL BOND FUND,FFMM-BANCHILE-8137,mutual_fund,,4,8137-k,http://www.cmfchile.cl
2356,conceptual_asset,FONDO MUTUO INVERSIÓN CHILE 30,FFMM-BANCHILE-8355,mutual_fund,,4,8355-0,http://www.cmfchile.cl
2221,conceptual_asset,FONDO MUTUO BOOSTER BALANCED CHILE,FFMM-BANCHILE-8921,mutual_fund,,4,8921-4,http://www.cmfchile.cl
2607,conceptual_asset,FONDO MUTUO SUPER FONDO TOP 50,FFMM-SANTANDER-8340,mutual_fund,,4,8340-2,http://www.cmfchile.cl
2608,conceptual_asset,FONDO MUTUO SUPER FONDO TOP 50 DOLAR,FFMM-SANTANDER-8341,mutual_fund,,4,8341-0,http://www.cmfchile.cl
1970,conceptual_asset,FONDO MUTUO SCOTIA ACCIONES CHILE MID CAP,FFMM-SCOTIA-8857,mutual_fund,,4,8857-9,http://www.cmfchile.cl
2241,conceptual_asset,FONDO MUTUO CAPITALISA ACCIONARIO,FFMM-BANCHILE-8001,mutual_fund,,4,8001-2,http://www.cmfchile.cl
2242,conceptual_asset,FONDO MUTUO CARRY TRADE MONEDAS GARANTIZADO,FFMM-BANCHILE-8727,mutual_fund,,4,8727-0,http://www.cmfchile.cl
2438,conceptual_asset,FONDO MUTUO LATAM MARKET,FFMM-BANCHILE-8851,mutual_fund,,4,8851-k,http://www.cmfchile.cl
2439,conceptual_asset,FONDO MUTUO LATIN AMERICA,FFMM-BANCHILE-8136,mutual_fund,,4,8136-1,http://www.cmfchile.cl
2441,conceptual_asset,FONDO MUTUO LIQUIDEZ FULL,FFMM-BANCHILE-8504,mutual_fund,,4,8504-9,http://www.cmfchile.cl
2442,conceptual_asset,FONDO MUTUO MARFIL GARANTIZADO,FFMM-BANCHILE-8468,mutual_fund,,4,8468-9,http://www.cmfchile.cl
2443,conceptual_asset,FONDO MUTUO MEDICAL & HEALTH-CARE FUND,FFMM-BANCHILE-8151,mutual_fund,,4,8151-5,http://www.cmfchile.cl
2451,conceptual_asset,FONDO MUTUO MURALLA CHINA GARANTIZADO,FFMM-BANCHILE-8734,mutual_fund,,4,8734-3,http://www.cmfchile.cl
2452,conceptual_asset,FONDO MUTUO MÉXICO ACCIONARIO,FFMM-BANCHILE-8842,mutual_fund,,4,8842-0,http://www.cmfchile.cl
2454,conceptual_asset,FONDO MUTUO OPERACIONAL,FFMM-BANCHILE-8034,mutual_fund,,4,8034-9,http://www.cmfchile.cl
2351,conceptual_asset,FONDO MUTUO INVERLINK MILLENIUM,FFMM-INVERLINK-8184,mutual_fund,,4,8184-1,http://www.cmfchile.cl
2455,conceptual_asset,FONDO MUTUO OPORTUNIDADES EMERGENTES,FFMM-BANCHILE-8667,mutual_fund,,4,8667-3,http://www.cmfchile.cl
2457,conceptual_asset,FONDO MUTUO PATRIMONIAL,FFMM-BANCHILE-8039,mutual_fund,,4,8039-k,http://www.cmfchile.cl
2475,conceptual_asset,FONDO MUTUO PERFORMANCE,FFMM-BANCHILE-8053,mutual_fund,,4,8053-5,http://www.cmfchile.cl
1885,conceptual_asset,FONDO MUTUO PORTAFOLIO ACTIVO DEFENSIVO,FFMM-BANCHILE-8452,mutual_fund,,4,8452-2,http://www.cmfchile.cl
2478,conceptual_asset,FONDO MUTUO POTENCIAS GARANTIZADO,FFMM-BANCHILE-8594,mutual_fund,,4,8594-4,http://www.cmfchile.cl
2606,conceptual_asset,FONDO MUTUO SMALL CAP USA GARANTIZADO,FFMM-BANCHILE-9018,mutual_fund,,4,9018-2,http://www.cmfchile.cl
2611,conceptual_asset,FONDO MUTUO TECHNOLOGY FUND,FFMM-BANCHILE-8150,mutual_fund,,4,8150-7,http://www.cmfchile.cl
2612,conceptual_asset,FONDO MUTUO TECNOLOGIA Y TELECOMUNICACIONES,FFMM-BANCHILE-8558,mutual_fund,,4,8558-8,http://www.cmfchile.cl
2631,conceptual_asset,FONDO MUTUO VISIÓN DINÁMICA C,FFMM-BANCHILE-8450,mutual_fund,,4,8450-6,http://www.cmfchile.cl
2632,conceptual_asset,FONDO MUTUO VISIÓN DINÁMICA D,FFMM-BANCHILE-8451,mutual_fund,,4,8451-4,http://www.cmfchile.cl
2633,conceptual_asset,FONDO MUTUO WALL STREET 107 GARANTIZADO,FFMM-BANCHILE-8548,mutual_fund,,4,8548-0,http://www.cmfchile.cl
1975,conceptual_asset,FONDO MUTUO SCOTIA MONEY MARKET DOLAR,FFMM-SCOTIA-8238,mutual_fund,USD,4,8238-4,http://www.cmfchile.cl
1542,conceptual_asset,FONDO DE INVERSIÓN NEVASA VISIÓN INTERNACIONAL,FINV-9402,investment_fund,,4,9402-1,http://www.cmfchile.cl
2488,conceptual_asset,FONDO MUTUO RENTA VARIABLE CHILE,FFMM-BANCHILE-8789,mutual_fund,CLP,4,8789-0,http://www.cmfchile.cl
2574,conceptual_asset,FONDO MUTUO SECURITY DIVERSIFICACION,FFMM-ADMINISTRADORA-8298,mutual_fund,,4,8298-8,http://www.cmfchile.cl
2576,conceptual_asset,FONDO MUTUO SECURITY DOLAR BOND,FFMM-ADMINISTRADORA-8324,mutual_fund,,4,8324-0,http://www.cmfchile.cl
2575,conceptual_asset,FONDO MUTUO SECURITY DOLAR BOND,FFMM-ADMINISTRADORA-8229,mutual_fund,,4,8229-5,http://www.cmfchile.cl
2005,conceptual_asset,FONDO MUTUO SECOND BEST ACCIONES LATINOAMERICANAS – ASIA EMERGENTE,FFMM-BANCHILE-9521,mutual_fund,CLP,4,9521-4,http://www.cmfchile.cl
1981,conceptual_asset,FONDO MUTUO SCOTIA LEADER,FFMM-SCOTIA-8050,mutual_fund,CLP,4,8050-0,http://www.cmfchile.cl
1544,conceptual_asset,FONDO DE INVERSIÓN SARTOR ACCIONES GLOBALES,FINV-9393,investment_fund,,4,9393-9,http://www.cmfchile.cl
1546,conceptual_asset,FONDO DE INVERSIÓN SARTOR PROYECCIÓN,FINV-9553,investment_fund,,4,9553-2,http://www.cmfchile.cl
2530,conceptual_asset,FONDO MUTUO SANTANDER SUPER FONDO 105,FFMM-SANTANDER-8330,mutual_fund,,4,8330-5,http://www.cmfchile.cl
1958,conceptual_asset,FONDO MUTUO SANTANDER SELECT PRUDENTE,FFMM-SANTANDER-8997,mutual_fund,CLP,4,8997-4,http://www.cmfchile.cl
2531,conceptual_asset,FONDO MUTUO SANTANDER SUPER FONDO 110,FFMM-SANTANDER-8331,mutual_fund,,4,8331-3,http://www.cmfchile.cl
2532,conceptual_asset,FONDO MUTUO SANTANDER SUPER FONDO 110 DOLAR,FFMM-SANTANDER-8339,mutual_fund,,4,8339-9,http://www.cmfchile.cl
2535,conceptual_asset,FONDO MUTUO SANTANDER SUPER INTERES,FFMM-SANTANDER-8191,mutual_fund,,4,8191-4,http://www.cmfchile.cl
2613,conceptual_asset,FONDO MUTUO TELECOMMUNICATION FUND,FFMM-BANCHILE-8146,mutual_fund,,4,8146-9,http://www.cmfchile.cl
2614,conceptual_asset,FONDO MUTUO TIGRES GARANTIZADO,FFMM-BANCHILE-8509,mutual_fund,,4,8509-k,http://www.cmfchile.cl
2617,conceptual_asset,FONDO MUTUO TWIN WIN EUROPA 103 GARANTIZADO,FFMM-BANCHILE-8949,mutual_fund,,4,8949-4,http://www.cmfchile.cl
2619,conceptual_asset,FONDO MUTUO TWIN WIN EUROPE EQUITY,FFMM-BANCHILE-9026,mutual_fund,,4,9026-3,http://www.cmfchile.cl
2618,conceptual_asset,FONDO MUTUO TWIN WIN EUROPE EQUITY,FFMM-BANCHILE-9037,mutual_fund,,4,9037-9,http://www.cmfchile.cl
2620,conceptual_asset,FONDO MUTUO TWIN WIN USA,FFMM-BANCHILE-8936,mutual_fund,,4,8936-2,http://www.cmfchile.cl
2621,conceptual_asset,FONDO MUTUO TWIN WIN USA PESOS,FFMM-BANCHILE-9008,mutual_fund,,4,9008-5,http://www.cmfchile.cl
2622,conceptual_asset,FONDO MUTUO U.S. STABILITY FUND,FFMM-BANCHILE-8138,mutual_fund,,4,8138-8,http://www.cmfchile.cl
2623,conceptual_asset,FONDO MUTUO U.S.HIGH TECHNOLOGY FUND,FFMM-BANCHILE-8143,mutual_fund,,4,8143-4,http://www.cmfchile.cl
2624,conceptual_asset,FONDO MUTUO USA CUPON PLUS NIVEL 100,FFMM-BANCHILE-9322,mutual_fund,,4,9322-k,http://www.cmfchile.cl
2625,conceptual_asset,FONDO MUTUO USA EQUITY TAX ADVANTAGE,FFMM-BANCHILE-8983,mutual_fund,,4,8983-4,http://www.cmfchile.cl
2626,conceptual_asset,FONDO MUTUO VERDE AMARELO GARANTIZADO,FFMM-BANCHILE-8526,mutual_fund,,4,8526-k,http://www.cmfchile.cl
2627,conceptual_asset,FONDO MUTUO VIEJO CONTINENTE ACCIONARIO,FFMM-BANCHILE-8210,mutual_fund,,4,8210-4,http://www.cmfchile.cl
2629,conceptual_asset,FONDO MUTUO VISIÓN DINÁMICA ACCIONES,FFMM-BANCHILE-8447,mutual_fund,,4,8447-6,http://www.cmfchile.cl
2630,conceptual_asset,FONDO MUTUO VISIÓN DINÁMICA B,FFMM-BANCHILE-8449,mutual_fund,,4,8449-2,http://www.cmfchile.cl
2064,conceptual_asset,FONDO MUTUO ZURICH CASH,FFMM-ZURICH-8345,mutual_fund,CLP,4,8345-3,http://www.cmfchile.cl
1586,conceptual_asset,VISION ACCIONES GLOBALES FONDO DE INVERSION,FFMM-ADMINISTRADORA-9334,mutual_fund,,4,9334-3,http://www.cmfchile.cl
1895,conceptual_asset,FONDO MUTUO PRINCIPAL DEUDA CORTO PLAZO,FFMM-PRINCIPAL-8250,mutual_fund,CLP,4,8250-3,http://www.cmfchile.cl
1988,conceptual_asset,FONDO MUTUO SCOTIA MONETARIO I,FFMM-SCOTIA-8757,mutual_fund,,4,8757-2,http://www.cmfchile.cl
2609,conceptual_asset,FONDO MUTUO SUPER SELECCION,FFMM-SANTANDER-8383,mutual_fund,,4,8383-6,http://www.cmfchile.cl
2077,conceptual_asset,FONDO MUTUO ZURICH USA,FFMM-ZURICH-9048,mutual_fund,,4,9048-4,http://www.cmfchile.cl
1990,conceptual_asset,FONDO MUTUO SCOTIA MONETARIO XIX,FFMM-SCOTIA-9166,mutual_fund,,4,9166-9,http://www.cmfchile.cl
1991,conceptual_asset,FONDO MUTUO SCOTIA MONETARIO XVIII,FFMM-SCOTIA-9065,mutual_fund,,4,9065-4,http://www.cmfchile.cl
1992,conceptual_asset,FONDO MUTUO SCOTIA MONETARIO XX,FFMM-SCOTIA-9253,mutual_fund,,4,9253-3,http://www.cmfchile.cl
1997,conceptual_asset,FONDO MUTUO SCOTIA RENTA BALANCEADA,FFMM-SCOTIA-8966,mutual_fund,,4,8966-4,http://www.cmfchile.cl
2110,conceptual_asset,FONDO MUTUO BANDESARROLLO GARANTIZADO 1,FFMM-SCOTIA-8473,mutual_fund,,4,8473-5,http://www.cmfchile.cl
2546,conceptual_asset,FONDO MUTUO SCOTIA EE.UU.,FFMM-SCOTIA-8605,mutual_fund,,4,8605-3,http://www.cmfchile.cl
2547,conceptual_asset,FONDO MUTUO SCOTIA GARANTIZADO 2008,FFMM-SCOTIA-8420,mutual_fund,,4,8420-4,http://www.cmfchile.cl
2548,conceptual_asset,FONDO MUTUO SCOTIA GARANTIZADO LOCKIN,FFMM-SCOTIA-8571,mutual_fund,,4,8571-5,http://www.cmfchile.cl
2549,conceptual_asset,FONDO MUTUO SCOTIA GARANTIZADO POTENCIA GLOBAL,FFMM-SCOTIA-8498,mutual_fund,,4,8498-0,http://www.cmfchile.cl
2551,conceptual_asset,FONDO MUTUO SCOTIA MERCADOS EMERGENTES,FFMM-SCOTIA-8828,mutual_fund,,4,8828-5,http://www.cmfchile.cl
1999,conceptual_asset,FONDO MUTUO SCOTIA DEUDA LARGO PLAZO UF,FFMM-SCOTIA-9154,mutual_fund,,4,9154-5,http://www.cmfchile.cl
2479,conceptual_asset,FONDO MUTUO PRINCIPAL BONOS INTERNACIONALES,FFMM-PRINCIPAL-8279,mutual_fund,,4,8279-1,http://www.cmfchile.cl
2480,conceptual_asset,FONDO MUTUO PRINCIPAL BRAZIL EQUITY,FFMM-PRINCIPAL-8791,mutual_fund,,4,8791-2,http://www.cmfchile.cl
1896,conceptual_asset,FONDO MUTUO PRINCIPAL DEUDA MEDIANO PLAZO,FFMM-PRINCIPAL-8422,mutual_fund,CLP,4,8422-0,http://www.cmfchile.cl
2477,conceptual_asset,FONDO MUTUO POTENCIAS CONSOLIDADAS GARANTIZADO,FFMM-BANCHILE-8735,mutual_fund,,4,8735-1,http://www.cmfchile.cl
2886,conceptual_asset,FONDO DE INVERSION LARRAINVIAL DEUDA LATAM LOW CARBON ESG,FINV-9867,investment_fund,,4,9867-1,http://www.cmfchile.cl
1540,conceptual_asset,FONDO DE INVERSIÓN LARRAINVIAL OPORTUNIDAD LATAM,FINV-9350,investment_fund,,4,9350-5,http://www.cmfchile.cl
1862,conceptual_asset,FONDO MUTUO LARRAINVIAL ASIA,FFMM-LARRAINVIAL-9023,mutual_fund,,4,9023-9,http://www.cmfchile.cl
1603,conceptual_asset,FONDO DE INVERSIÓN LARRAINVIAL ACCIONES GLOBALES,FINV-9320,investment_fund,,4,9320-3,http://www.cmfchile.cl
1604,conceptual_asset,FONDO DE INVERSIÓN LARRAINVIAL GLOBAL,FINV-9159,investment_fund,,4,9159-6,http://www.cmfchile.cl
1605,conceptual_asset,FONDO DE INVERSIÓN LARRAINVIAL OPPORTUNITIES,FINV-9160,investment_fund,,4,9160-k,http://www.cmfchile.cl
1606,conceptual_asset,FONDO DE INVERSIÓN LARRAINVIAL PATRIMONIO,FINV-9370,investment_fund,,4,9370-k,http://www.cmfchile.cl
2335,conceptual_asset,FONDO MUTUO GLOBAL EQUITY,FFMM-LARRAINVIAL-8173,mutual_fund,,4,8173-6,http://www.cmfchile.cl
2354,conceptual_asset,FONDO MUTUO INVERSION BRASIL,FFMM-LARRAINVIAL-8652,mutual_fund,,4,8652-5,http://www.cmfchile.cl
2355,conceptual_asset,FONDO MUTUO INVERSION PERU,FFMM-LARRAINVIAL-8654,mutual_fund,,4,8654-1,http://www.cmfchile.cl
2750,conceptual_asset,FONDO MUTUO LARRAINVIAL CUENTA ACTIVA CONSERVADORA DÓLAR,FFMM-LARRAINVIAL-9853,mutual_fund,,4,9853-1,http://www.cmfchile.cl
2740,conceptual_asset,FONDO MUTUO LARRAINVIAL CUENTA ACTIVA MODERADA DÓLAR,FFMM-LARRAINVIAL-9816,mutual_fund,,4,9816-7,http://www.cmfchile.cl
1863,conceptual_asset,FONDO MUTUO LARRAINVIAL CUENTA ACTIVA DEFENSIVA DÓLAR,FFMM-LARRAINVIAL-8172,mutual_fund,USD,4,8172-8,http://www.cmfchile.cl
1756,conceptual_asset,FONDO MUTUO CONSORCIO ACCIONES CHILENAS,FFMM-LARRAINVIAL-8170,mutual_fund,,4,8170-1,http://www.cmfchile.cl
1495,conceptual_asset,FONDO DE INVERSION LARRAINVIAL QUANT LATAM,FFMM-LARRAINVIAL-9298,mutual_fund,,4,9298-3,http://www.cmfchile.cl
