id,type,name,symbol,category,currency,max_scale,run,data_source
1526,conceptual_asset,FONDO DE INVERSIÓN LARRAINVIAL ARGENTINA EQUITY,FINV-9659,investment_fund,,4,9659-8,http://www.cmfchile.cl
2397,conceptual_asset,FONDO MUTUO LARRAIN VIAL ACCIONES BENEFICIO,FFMM-LARRAINVIAL-8282,mutual_fund,,4,8282-1,http://www.cmfchile.cl
2398,conceptual_asset,FONDO MUTUO LARRAIN VIAL ACCIONES NACIONALES,FFMM-LARRAINVIAL-8096,mutual_fund,,4,8096-9,http://www.cmfchile.cl
2399,conceptual_asset,FONDO MUTUO LARRAIN VIAL AHORRO A PLAZO,FFMM-LARRAINVIAL-8124,mutual_fund,,4,8124-8,http://www.cmfchile.cl
2400,conceptual_asset,FONDO MUTUO LARRAIN VIAL ALTO RENDIMIENTO,FFMM-LARRAINVIAL-8388,mutual_fund,,4,8388-7,http://www.cmfchile.cl
2401,conceptual_asset,FONDO MUTUO LARRAIN VIAL BRASIL RETORNO TOTAL,FFMM-LARRAINVIAL-8432,mutual_fund,,4,8432-8,http://www.cmfchile.cl
2402,conceptual_asset,FONDO MUTUO LARRAIN VIAL DEPOSITO INTERNACIONAL,FFMM-LARRAINVIAL-8166,mutual_fund,,4,8166-3,http://www.cmfchile.cl
2403,conceptual_asset,FONDO MUTUO LARRAIN VIAL ENFOQUE,FFMM-LARRAINVIAL-8368,mutual_fund,,4,8368-2,http://www.cmfchile.cl
2469,conceptual_asset,FONDO MUTUO PENTA RENTA NOMINAL CHILE,FFMM-PENTA-8312,mutual_fund,,4,8312-7,http://www.cmfchile.cl
2485,conceptual_asset,FONDO MUTUO RENTA FUTURA,FFMM-BANCHILE-8201,mutual_fund,,4,8201-5,http://www.cmfchile.cl
1875,conceptual_asset,FONDO MUTUO LARRAINVIAL MERCADO MONETARIO,FFMM-LARRAINVIAL-8130,mutual_fund,CLP,4,8130-2,http://www.cmfchile.cl
2526,conceptual_asset,FONDO MUTUO SANTANDER PORTFOLIO CONSERVADOR,FFMM-SANTANDER-8213,mutual_fund,,4,8213-9,http://www.cmfchile.cl
2405,conceptual_asset,FONDO MUTUO LARRAIN VIAL EUROPA,FFMM-LARRAINVIAL-8497,mutual_fund,,4,8497-2,http://www.cmfchile.cl
2406,conceptual_asset,FONDO MUTUO LARRAIN VIAL LATINOAMERICANO,FFMM-LARRAINVIAL-8192,mutual_fund,,4,8192-2,http://www.cmfchile.cl
2410,conceptual_asset,FONDO MUTUO LARRAIN VIAL PROTECCION,FFMM-LARRAINVIAL-8369,mutual_fund,,4,8369-0,http://www.cmfchile.cl
1527,conceptual_asset,FONDO DE INVERSIÓN LARRAINVIAL ACCIONARIO GLOBAL,FINV-9389,investment_fund,,4,9389-0,http://www.cmfchile.cl
1528,conceptual_asset,FONDO DE INVERSIÓN LARRAINVIAL CHILE EQUITY,FINV-9169,investment_fund,,4,9169-3,http://www.cmfchile.cl
1529,conceptual_asset,FONDO DE INVERSIÓN LARRAINVIAL DEUDA CORPORATIVA,FINV-7210,investment_fund,,4,7210-9,http://www.cmfchile.cl
1530,conceptual_asset,FONDO DE INVERSIÓN LARRAINVIAL DEUDA LATAM HIGH YIELD,FINV-7064,investment_fund,,4,7064-5,http://www.cmfchile.cl
1532,conceptual_asset,FONDO DE INVERSIÓN LARRAINVIAL DEUDA LOCAL,FINV-9279,investment_fund,,4,9279-7,http://www.cmfchile.cl
2411,conceptual_asset,FONDO MUTUO LARRAINVIAL ACCIONES BENEFICIO,FFMM-LARRAINVIAL-8873,mutual_fund,,4,8873-0,http://www.cmfchile.cl
2412,conceptual_asset,FONDO MUTUO LARRAINVIAL AHORRO CENTRAL,FFMM-LARRAINVIAL-8241,mutual_fund,,4,8241-4,http://www.cmfchile.cl
2413,conceptual_asset,FONDO MUTUO LARRAINVIAL AHORRO LARGO NOMINAL,FFMM-LARRAINVIAL-9064,mutual_fund,,4,9064-6,http://www.cmfchile.cl
2415,conceptual_asset,FONDO MUTUO LARRAINVIAL BONOS CORPORATIVOS BRASIL,FFMM-LARRAINVIAL-8171,mutual_fund,,4,8171-k,http://www.cmfchile.cl
2416,conceptual_asset,FONDO MUTUO LARRAINVIAL BRASIL,FFMM-LARRAINVIAL-8780,mutual_fund,,4,8780-7,http://www.cmfchile.cl
2417,conceptual_asset,FONDO MUTUO LARRAINVIAL BRASIL SMALL & MID CAPS,FFMM-LARRAINVIAL-8833,mutual_fund,,4,8833-1,http://www.cmfchile.cl
2418,conceptual_asset,FONDO MUTUO LARRAINVIAL BRIC,FFMM-LARRAINVIAL-8431,mutual_fund,,4,8431-k,http://www.cmfchile.cl
2419,conceptual_asset,FONDO MUTUO LARRAINVIAL COLOMBIA,FFMM-LARRAINVIAL-8874,mutual_fund,,4,8874-9,http://www.cmfchile.cl
2420,conceptual_asset,FONDO MUTUO LARRAINVIAL CRECIMIENTO,FFMM-LARRAINVIAL-8469,mutual_fund,,4,8469-7,http://www.cmfchile.cl
1539,conceptual_asset,FONDO DE INVERSIÓN LARRAINVIAL DEUDA ESTRATÉGICA,FINV-9391,investment_fund,,4,9391-2,http://www.cmfchile.cl
1531,conceptual_asset,FONDO DE INVERSIÓN LARRAINVIAL DEUDA LATAM UF,FINV-9150,investment_fund,,4,9150-2,http://www.cmfchile.cl
1533,conceptual_asset,FONDO DE INVERSIÓN LARRAINVIAL DEUDA RETORNO ABSOLUTO,FINV-9346,investment_fund,,4,9346-7,http://www.cmfchile.cl
1535,conceptual_asset,FONDO DE INVERSIÓN LARRAINVIAL FACTURAS,FINV-9306,investment_fund,,4,9306-8,http://www.cmfchile.cl
1537,conceptual_asset,FONDO DE INVERSIÓN LARRAINVIAL LATAM LOCAL CURRENCY DEBT,FINV-7185,investment_fund,,4,7185-4,http://www.cmfchile.cl
1536,conceptual_asset,FONDO DE INVERSIÓN LARRAINVIAL LATAM EQUITY,FINV-9149,investment_fund,,4,9149-9,http://www.cmfchile.cl
2421,conceptual_asset,FONDO MUTUO LARRAINVIAL DISPONIBLE,FFMM-LARRAINVIAL-8938,mutual_fund,,4,8938-9,http://www.cmfchile.cl
2422,conceptual_asset,FONDO MUTUO LARRAINVIAL DOLAR GLOBAL,FFMM-LARRAINVIAL-8704,mutual_fund,,4,8704-1,http://www.cmfchile.cl
2423,conceptual_asset,FONDO MUTUO LARRAINVIAL ESPAÑA,FFMM-LARRAINVIAL-9068,mutual_fund,,4,9068-9,http://www.cmfchile.cl
2424,conceptual_asset,FONDO MUTUO LARRAINVIAL INVERSION MUNDIAL,FFMM-LARRAINVIAL-8436,mutual_fund,,4,8436-0,http://www.cmfchile.cl
2425,conceptual_asset,FONDO MUTUO LARRAINVIAL LATAM EX BRASIL,FFMM-LARRAINVIAL-8917,mutual_fund,,4,8917-6,http://www.cmfchile.cl
2426,conceptual_asset,FONDO MUTUO LARRAINVIAL LATAM SMALL & MID CAPS,FFMM-LARRAINVIAL-8531,mutual_fund,,4,8531-6,http://www.cmfchile.cl
2427,conceptual_asset,FONDO MUTUO LARRAINVIAL LIDER BRASIL,FFMM-LARRAINVIAL-8552,mutual_fund,,4,8552-9,http://www.cmfchile.cl
2428,conceptual_asset,FONDO MUTUO LARRAINVIAL MANDARIN,FFMM-LARRAINVIAL-8499,mutual_fund,,4,8499-9,http://www.cmfchile.cl
2429,conceptual_asset,FONDO MUTUO LARRAINVIAL MEGATENDENCIAS,FFMM-LARRAINVIAL-8818,mutual_fund,,4,8818-8,http://www.cmfchile.cl
2430,conceptual_asset,FONDO MUTUO LARRAINVIAL MERCADOS EMERGENTES,FFMM-LARRAINVIAL-8198,mutual_fund,,4,8198-1,http://www.cmfchile.cl
2433,conceptual_asset,FONDO MUTUO LARRAINVIAL PERU,FFMM-LARRAINVIAL-8706,mutual_fund,,4,8706-8,http://www.cmfchile.cl
2434,conceptual_asset,FONDO MUTUO LARRAINVIAL PORTFOLIO ALTERNATIVO,FFMM-LARRAINVIAL-9293,mutual_fund,,4,9293-2,http://www.cmfchile.cl
1534,conceptual_asset,FONDO DE INVERSIÓN LARRAINVIAL ESTADOS UNIDOS,FINV-9443,investment_fund,USD,4,9443-9,http://www.cmfchile.cl
2435,conceptual_asset,FONDO MUTUO LARRAINVIAL PRECISION,FFMM-LARRAINVIAL-8419,mutual_fund,,4,8419-0,http://www.cmfchile.cl
2436,conceptual_asset,FONDO MUTUO LARRAINVIAL RETORNO TOTAL,FFMM-LARRAINVIAL-8376,mutual_fund,,4,8376-3,http://www.cmfchile.cl
2437,conceptual_asset,FONDO MUTUO LARRAINVIAL RETORNO TOTAL DOLAR,FFMM-LARRAINVIAL-8530,mutual_fund,,4,8530-8,http://www.cmfchile.cl
2449,conceptual_asset,FONDO MUTUO MULTI BALANCEADO DÓLAR,FFMM-LARRAINVIAL-8470,mutual_fund,,4,8470-0,http://www.cmfchile.cl
2450,conceptual_asset,FONDO MUTUO MULTI PROTECCIÓN DÓLAR,FFMM-LARRAINVIAL-8476,mutual_fund,,4,8476-k,http://www.cmfchile.cl
1714,conceptual_asset,FONDO MUTUO BICE RENTA LARGO PLAZO,FFMM-BICE-9238,mutual_fund,,4,9238-k,http://www.cmfchile.cl
2589,conceptual_asset,FONDO MUTUO SECURITY LEADER 100 GARANTIZADO,FFMM-ADMINISTRADORA-8391,mutual_fund,,4,8391-7,http://www.cmfchile.cl
2258,conceptual_asset,FONDO MUTUO COLOMBIA,FFMM-LARRAINVIAL-8540,mutual_fund,,4,8540-5,http://www.cmfchile.cl
2590,conceptual_asset,FONDO MUTUO SECURITY LIQUIDEZ,FFMM-ADMINISTRADORA-8261,mutual_fund,,4,8261-9,http://www.cmfchile.cl
2261,conceptual_asset,FONDO MUTUO CONSORCIO AHORRO NOMINAL,FFMM-LARRAINVIAL-8532,mutual_fund,,4,8532-4,http://www.cmfchile.cl
2591,conceptual_asset,FONDO MUTUO SECURITY MONEY MARKET,FFMM-ADMINISTRADORA-8311,mutual_fund,,4,8311-9,http://www.cmfchile.cl
2262,conceptual_asset,FONDO MUTUO CONSORCIO AHORRO UF,FFMM-LARRAINVIAL-8246,mutual_fund,,4,8246-5,http://www.cmfchile.cl
2407,conceptual_asset,FONDO MUTUO LARRAIN VIAL LIDER DOLAR,FFMM-LARRAINVIAL-8314,mutual_fund,,4,8314-3,http://www.cmfchile.cl
2592,conceptual_asset,FONDO MUTUO SECURITY MONEY MARKET DÓLAR,FFMM-ADMINISTRADORA-8572,mutual_fund,,4,8572-3,http://www.cmfchile.cl
2408,conceptual_asset,FONDO MUTUO LARRAIN VIAL MULTIMERCADO,FFMM-LARRAINVIAL-8545,mutual_fund,,4,8545-6,http://www.cmfchile.cl
2409,conceptual_asset,FONDO MUTUO LARRAIN VIAL PERU,FFMM-LARRAINVIAL-8617,mutual_fund,,4,8617-7,http://www.cmfchile.cl
2404,conceptual_asset,FONDO MUTUO LARRAIN VIAL EURO DOLAR,FFMM-LARRAINVIAL-8271,mutual_fund,,4,8271-6,http://www.cmfchile.cl
2593,conceptual_asset,FONDO MUTUO SECURITY MUNDO EMERGENTE,FFMM-ADMINISTRADORA-8568,mutual_fund,,4,8568-5,http://www.cmfchile.cl
2634,conceptual_asset,FONDO MUTUO XTRA INCOME,FFMM-LARRAINVIAL-8291,mutual_fund,,4,8291-0,http://www.cmfchile.cl
1716,conceptual_asset,FONDO MUTUO BICE RENTA UF,FFMM-BICE-8141,mutual_fund,CLP,4,8141-8,http://www.cmfchile.cl
1710,conceptual_asset,FONDO MUTUO BICE ESTRATEGIA MÁS CONSERVADORA,FFMM-BICE-8933,mutual_fund,CLP,4,8933-8,http://www.cmfchile.cl
1712,conceptual_asset,FONDO MUTUO BICE LIQUIDEZ PESOS,FFMM-BICE-8063,mutual_fund,CLP,4,8063-2,http://www.cmfchile.cl
1711,conceptual_asset,FONDO MUTUO BICE LIQUIDEZ DÓLAR,FFMM-BICE-8506,mutual_fund,USD,4,8506-5,http://www.cmfchile.cl
1713,conceptual_asset,FONDO MUTUO BICE RENTA CORTO PLAZO,FFMM-BICE-8902,mutual_fund,CLP,4,8902-8,http://www.cmfchile.cl
1799,conceptual_asset,FONDO MUTUO ZURICH DOLAR,FFMM-ZURICH-8629,mutual_fund,USD,4,8629-0,http://www.cmfchile.cl
1549,conceptual_asset,FONDO DE INVERSIÓN SECURITY DEUDA LATAM EN UF,FINV-9128,investment_fund,,4,9128-6,http://www.cmfchile.cl
1785,conceptual_asset,FONDO MUTUO BANCHILE EMERGING,FFMM-BANCHILE-8054,mutual_fund,CLP,4,8054-3,http://www.cmfchile.cl
1786,conceptual_asset,FONDO MUTUO BANCHILE EMERGING MARKET,FFMM-BANCHILE-8299,mutual_fund,USD,4,8299-6,http://www.cmfchile.cl
1821,conceptual_asset,FONDO MUTUO BANCHILE EUROPA DESARROLLADA,FFMM-BANCHILE-8129,mutual_fund,CLP,4,8129-9,http://www.cmfchile.cl
1826,conceptual_asset,FONDO MUTUO BANCHILE GLOBAL DOLLAR,FFMM-BANCHILE-8301,mutual_fund,USD,4,8301-1,http://www.cmfchile.cl
1827,conceptual_asset,FONDO MUTUO BANCHILE GLOBAL MID CAP,FFMM-BANCHILE-8088,mutual_fund,CLP,4,8088-8,http://www.cmfchile.cl
1828,conceptual_asset,FONDO MUTUO BANCHILE HORIZONTE,FFMM-BANCHILE-8023,mutual_fund,CLP,4,8023-3,http://www.cmfchile.cl
1749,conceptual_asset,FONDO MUTUO BANCHILE COBERTURA DEUDA GLOBAL,FFMM-BANCHILE-9561,mutual_fund,CLP,4,9561-3,http://www.cmfchile.cl
1755,conceptual_asset,FONDO MUTUO COMPROMISO BANCOESTADO,FFMM-BANCOESTADO-8317,mutual_fund,CLP,4,8317-8,http://www.cmfchile.cl
1766,conceptual_asset,FONDO MUTUO CONVENIENCIA BANCOESTADO,FFMM-BANCOESTADO-8320,mutual_fund,CLP,4,8320-8,http://www.cmfchile.cl
1538,conceptual_asset,FONDO DE INVERSIÓN LARRAINVIAL SMALL AND MID CAP LATAM,FINV-7127,investment_fund,,4,7127-7,http://www.cmfchile.cl
1541,conceptual_asset,FONDO DE INVERSIÓN LARRAINVIAL PERÚ EQUITY,FINV-9171,investment_fund,,4,9171-5,http://www.cmfchile.cl
1559,conceptual_asset,MBI DEUDA TOTAL FONDO DE INVERSIÓN,FINV-9202,investment_fund,,4,9202-9,http://www.cmfchile.cl
1548,conceptual_asset,FONDO DE INVERSIÓN SARTOR TACTICO INTERNACIONAL,FINV-9628,investment_fund,,4,9628-8,http://www.cmfchile.cl
1545,conceptual_asset,FONDO DE INVERSIÓN SARTOR LEASING,FINV-9392,investment_fund,,4,9392-0,http://www.cmfchile.cl
1691,conceptual_asset,FONDO MUTUO BICE ACCIONES CHILE ACTIVO,FFMM-BICE-8819,mutual_fund,CLP,4,8819-6,http://www.cmfchile.cl
1692,conceptual_asset,FONDO MUTUO BICE ACCIONES CHILE MID CAP,FFMM-BICE-8553,mutual_fund,CLP,4,8553-7,http://www.cmfchile.cl
1835,conceptual_asset,FONDO MUTUO ITAU AHORRO CORTO PLAZO,FFMM-ITAU-8352,mutual_fund,CLP,4,8352-6,http://www.cmfchile.cl
1837,conceptual_asset,FONDO MUTUO ITAU ANDINO RETORNO TOTAL,FFMM-ITAU-8979,mutual_fund,CLP,4,8979-6,http://www.cmfchile.cl
1555,conceptual_asset,MBI DEUDA ALTERNATIVA FONDO DE INVERSIÓN,FINV-9203,investment_fund,CLP,4,9203-7,http://www.cmfchile.cl
1757,conceptual_asset,FONDO MUTUO CONSORCIO AHORRO DINÁMICO,FFMM-LARRAINVIAL-8375,mutual_fund,CLP,4,8375-5,http://www.cmfchile.cl
1791,conceptual_asset,FONDO MUTUO ETF ZURICH MSCI SMALL CAP CHILE,FFMM-ZURICH-9533,mutual_fund,,4,9533-8,http://www.cmfchile.cl
1882,conceptual_asset,FONDO MUTUO BANCHILE MID CAP,FFMM-BANCHILE-8062,mutual_fund,,4,8062-4,http://www.cmfchile.cl
1726,conceptual_asset,FONDO MUTUO BTG PACTUAL ACCIONES CHILENAS,FFMM-BTG-8204,mutual_fund,,4,8204-k,http://www.cmfchile.cl
1839,conceptual_asset,FONDO MUTUO ITAU DEUDA CORPORATIVA CHILE,FFMM-ITAU-9248,mutual_fund,CLP,4,9248-7,http://www.cmfchile.cl
2648,conceptual_asset,MONEDA RENTA VARIABLE ARGENTINA FONDO DE INVERSIÓN,FINV-9751,investment_fund,,4,9751-9,http://www.cmfchile.cl
1564,conceptual_asset,MBI RENTA FIJA PLUS DÓLAR FONDO DE INVERSIÓN,FINV-9091,investment_fund,,4,9091-3,http://www.cmfchile.cl
1556,conceptual_asset,MBI DEUDA EMERGENTE FONDO DE INVERSION,FINV-9301,investment_fund,,4,9301-7,http://www.cmfchile.cl
1566,conceptual_asset,MONEDA DEUDA CHILE FONDO DE INVERSIÓN,FINV-9212,investment_fund,,4,9212-6,http://www.cmfchile.cl
1561,conceptual_asset,MBI OPORTUNIDADES FONDO DE INVERSION,FINV-9119,investment_fund,,4,9119-7,http://www.cmfchile.cl
1569,conceptual_asset,MONEDA RENTA FIJA INTERNACIONAL HIGH-YIELD FONDO DE INVERSION,FINV-9267,investment_fund,,4,9267-3,http://www.cmfchile.cl
2020,conceptual_asset,FONDO MUTUO SECURITY GOLD,FFMM-ADMINISTRADORA-8118,mutual_fund,CLP,4,8118-3,http://www.cmfchile.cl
2373,conceptual_asset,FONDO MUTUO ITAU MAS FUTURO,FFMM-ITAU-8119,mutual_fund,,4,8119-1,http://www.cmfchile.cl
2008,conceptual_asset,FONDO MUTUO SECURITY CORPORATIVO,FFMM-ADMINISTRADORA-8806,mutual_fund,CLP,4,8806-4,http://www.cmfchile.cl
2025,conceptual_asset,FONDO MUTUO SECURITY MID TERM,FFMM-ADMINISTRADORA-8881,mutual_fund,CLP,4,8881-1,http://www.cmfchile.cl
2088,conceptual_asset,FONDO MUTUO ALIANZA PACIFICO ACCIONARIO,FFMM-BANCHILE-8829,mutual_fund,CLP,4,8829-3,http://www.cmfchile.cl
1616,conceptual_asset,FONDO MUTUO BANCHILE ASIA,FFMM-BANCHILE-8131,mutual_fund,CLP,4,8131-0,http://www.cmfchile.cl
1617,conceptual_asset,FONDO MUTUO BANCHILE ASIATICO ACCIONARIO,FFMM-BANCHILE-8517,mutual_fund,CLP,4,8517-0,http://www.cmfchile.cl
1919,conceptual_asset,FONDO MUTUO BANCHILE RETORNO L.P. UF,FFMM-BANCHILE-8028,mutual_fund,CLP,4,8028-4,http://www.cmfchile.cl
2059,conceptual_asset,FONDO MUTUO BANCHILE U.S DOLLAR,FFMM-BANCHILE-8300,mutual_fund,USD,4,8300-3,http://www.cmfchile.cl
2550,conceptual_asset,FONDO MUTUO SCOTIA GLOBAL ACCIONES,FFMM-SCOTIA-8101,mutual_fund,,4,8101-9,http://www.cmfchile.cl
1554,conceptual_asset,MBI BEST IDEAS LATAM FONDO DE INVERSION,FINV-7278,investment_fund,,4,7278-8,http://www.cmfchile.cl
1565,conceptual_asset,MONEDA ALTURAS II FONDO DE INVERSIÓN,FINV-9614,investment_fund,,4,9614-8,http://www.cmfchile.cl
1928,conceptual_asset,FONDO MUTUO SANTANDER ACCIONES MID CAP CHILE,FFMM-SANTANDER-9537,mutual_fund,CLP,4,9537-0,http://www.cmfchile.cl
1890,conceptual_asset,FONDO MUTUO PRINCIPAL CAPITALES ACCIONES CHILENAS,FFMM-PRINCIPAL-8038,mutual_fund,CLP,4,8038-1,http://www.cmfchile.cl
2785,conceptual_asset,FONDO MUTUO BCI PORTAFOLIO ESTRUCTURADO 20,FFMM-BCI-9875,mutual_fund,CLP,4,9875-2,http://www.cmfchile.cl
66,conceptual_asset,ICP,ICPCLP,index,CLP,2,,https://www.cbf.cl
1563,conceptual_asset,MBI RENDIMIENTO TOTAL FONDO DE INVERSIÓN,FINV-9480,investment_fund,,4,9480-3,http://www.cmfchile.cl
1567,conceptual_asset,MONEDA DEUDA LATAM INVESTMENT GRADE FONDO DE INVERSIÓN,FINV-9277,investment_fund,,4,9277-0,http://www.cmfchile.cl
1568,conceptual_asset,MONEDA LATAM EQUITY FONDO DE INVERSIÓN,FINV-9304,investment_fund,,4,9304-1,http://www.cmfchile.cl
1553,conceptual_asset,MBI ARBITRAGE FONDO DE INVERSIÓN,FINV-7089,investment_fund,,4,7089-0,http://www.cmfchile.cl
1634,conceptual_asset,FONDO MUTUO BCI ASIA,FFMM-BCI-8514,mutual_fund,CLP,4,8514-6,http://www.cmfchile.cl
2552,conceptual_asset,FONDO MUTUO SCOTIA OPTIMO,FFMM-SCOTIA-8079,mutual_fund,,4,8079-9,http://www.cmfchile.cl
2553,conceptual_asset,FONDO MUTUO SCOTIA PATRIMONIO ACCIONES,FFMM-SCOTIA-8068,mutual_fund,,4,8068-3,http://www.cmfchile.cl
2554,conceptual_asset,FONDO MUTUO SCOTIA PRIORIDAD,FFMM-SCOTIA-8255,mutual_fund,,4,8255-4,http://www.cmfchile.cl
1891,conceptual_asset,FONDO MUTUO PRINCIPAL CARTERA AUDAZ,FFMM-PRINCIPAL-9593,mutual_fund,CLP,4,9593-1,http://www.cmfchile.cl
1761,conceptual_asset,FONDO MUTUO CONSORCIO DINÁMICO AGRESIVO,FFMM-LARRAINVIAL-9428,mutual_fund,CLP,4,9428-5,http://www.cmfchile.cl
1762,conceptual_asset,FONDO MUTUO CONSORCIO DINÁMICO BALANCEADO,FFMM-LARRAINVIAL-9429,mutual_fund,CLP,4,9429-3,http://www.cmfchile.cl
1763,conceptual_asset,FONDO MUTUO CONSORCIO DINÁMICO CONSERVADOR,FFMM-LARRAINVIAL-9430,mutual_fund,CLP,4,9430-7,http://www.cmfchile.cl
1764,conceptual_asset,FONDO MUTUO CONSORCIO DINÁMICO CRECIMIENTO,FFMM-LARRAINVIAL-9431,mutual_fund,CLP,4,9431-5,http://www.cmfchile.cl
1765,conceptual_asset,FONDO MUTUO CONSORCIO DINÁMICO MODERADO,FFMM-LARRAINVIAL-9432,mutual_fund,CLP,4,9432-3,http://www.cmfchile.cl
1889,conceptual_asset,FONDO MUTUO PRINCIPAL ASIA EQUITY,FFMM-PRINCIPAL-8438,mutual_fund,CLP,4,8438-7,http://www.cmfchile.cl
1872,conceptual_asset,FONDO MUTUO LARRAINVIAL EUROPA,FFMM-LARRAINVIAL-9027,mutual_fund,USD,4,9027-1,http://www.cmfchile.cl
1892,conceptual_asset,FONDO MUTUO PRINCIPAL CARTERA DEFENSIVA,FFMM-PRINCIPAL-9596,mutual_fund,CLP,4,9596-6,http://www.cmfchile.cl
1575,conceptual_asset,QUEST GLOBAL DEBT FONDO DE INVERSIÓN,FINV-9503,investment_fund,,4,9503-6,http://www.cmfchile.cl
1577,conceptual_asset,QUEST RENTA GLOBAL FONDO DE INVERSION,FINV-9274,investment_fund,,4,9274-6,http://www.cmfchile.cl
1576,conceptual_asset,QUEST GLOBAL EQUITY FONDO DE INVERSIÓN,FINV-9504,investment_fund,,4,9504-4,http://www.cmfchile.cl
1574,conceptual_asset,QUEST ACCIONES CHILE FONDO DE INVERSION,FINV-9152,investment_fund,,4,9152-9,http://www.cmfchile.cl
1578,conceptual_asset,QUEST RENTA GLOBAL HEDGE FONDO DE INVERSIÓN,FINV-9336,investment_fund,,4,9336-k,http://www.cmfchile.cl
2060,conceptual_asset,FONDO MUTUO BANCHILE US MID CAP,FFMM-BANCHILE-8189,mutual_fund,CLP,4,8189-2,http://www.cmfchile.cl
2555,conceptual_asset,FONDO MUTUO SCOTIA PROGRESO,FFMM-SCOTIA-9156,mutual_fund,,4,9156-1,http://www.cmfchile.cl
2556,conceptual_asset,FONDO MUTUO SCOTIA RETORNO,FFMM-SCOTIA-8073,mutual_fund,,4,8073-k,http://www.cmfchile.cl
2557,conceptual_asset,FONDO MUTUO SCOTIA RETORNO (FUSIONADO RUN 8238),FFMM-SCOTIA-8281,mutual_fund,,4,8281-3,http://www.cmfchile.cl
1922,conceptual_asset,FONDO MUTUO SANTANDER ACCIONES ASIA EMERGENTE,FFMM-SANTANDER-8159,mutual_fund,CLP,4,8159-0,http://www.cmfchile.cl
1927,conceptual_asset,FONDO MUTUO SANTANDER ACCIONES LATINOAMÉRICA,FFMM-SANTANDER-8160,mutual_fund,CLP,4,8160-4,http://www.cmfchile.cl
1925,conceptual_asset,FONDO MUTUO SANTANDER GO ACCIONES GLOBALES ESG,FFMM-SANTANDER-8090,mutual_fund,,4,8090-k,http://www.cmfchile.cl
1939,conceptual_asset,FONDO MUTUO SANTANDER E,FFMM-SANTANDER-8387,mutual_fund,CLP,4,8387-9,http://www.cmfchile.cl
1933,conceptual_asset,FONDO MUTUO SANTANDER B,FFMM-SANTANDER-8576,mutual_fund,CLP,4,8576-6,http://www.cmfchile.cl
1931,conceptual_asset,FONDO MUTUO SANTANDER GO ACCIONES USA,FFMM-SANTANDER-8488,mutual_fund,CLP,4,8488-3,http://www.cmfchile.cl
1940,conceptual_asset,FONDO MUTUO SANTANDER F,FFMM-SANTANDER-9405,mutual_fund,CLP,4,9405-6,http://www.cmfchile.cl
1935,conceptual_asset,FONDO MUTUO SANTANDER D,FFMM-SANTANDER-8900,mutual_fund,CLP,4,8900-1,http://www.cmfchile.cl
1920,conceptual_asset,FONDO MUTUO SANTANDER C,FFMM-SANTANDER-8578,mutual_fund,CLP,4,8578-2,http://www.cmfchile.cl
1934,conceptual_asset,FONDO MUTUO SANTANDER BONOS NACIONALES,FFMM-SANTANDER-8287,mutual_fund,CLP,4,8287-2,http://www.cmfchile.cl
1570,conceptual_asset,MONEDA RENTA FIJA INTERNACIONAL INVESTMENT GRADE,FINV-9268,investment_fund,,4,9268-1,http://www.cmfchile.cl
2561,conceptual_asset,FONDO MUTUO SECURITY AMERICA 106 GARANTIZADO,FFMM-ADMINISTRADORA-8547,mutual_fund,,4,8547-2,http://www.cmfchile.cl
1620,conceptual_asset,FONDO MUTUO BANCOESTADO ACCIONES NACIONALES,FFMM-BANCOESTADO-8536,mutual_fund,,4,8536-7,http://www.cmfchile.cl
2061,conceptual_asset,FONDO MUTUO BANCHILE UTILIDADES,FFMM-BANCHILE-8127,mutual_fund,CLP,4,8127-2,http://www.cmfchile.cl
1619,conceptual_asset,FONDO MUTUO BANCHILE-ACCIONES,FFMM-BANCHILE-8043,mutual_fund,,4,8043-8,http://www.cmfchile.cl
1623,conceptual_asset,FONDO MUTUO BANCOESTADO BNP PARIBAS MAS RENTA BICENTENARIO,FFMM-BANCOESTADO-8807,mutual_fund,CLP,4,8807-2,http://www.cmfchile.cl
2560,conceptual_asset,FONDO MUTUO SECOND BEST EUROPA CHINA GARANTIZADO,FFMM-BANCHILE-9002,mutual_fund,,4,9002-6,http://www.cmfchile.cl
1621,conceptual_asset,FONDO MUTUO BANCOESTADO AHORRO CORTO PLAZO,FFMM-BANCOESTADO-9291,mutual_fund,CLP,4,9291-6,http://www.cmfchile.cl
1742,conceptual_asset,FONDO MUTUO BTG PACTUAL RENTA LATINOAMERICANA INVESTMENT GRADE,FFMM-BTG-9449,mutual_fund,USD,4,9449-8,http://www.cmfchile.cl
2240,conceptual_asset,FONDO MUTUO BTG PACTUAL RENTA ARGENTINA,FFMM-BTG-9541,mutual_fund,CLP,4,9541-9,http://www.cmfchile.cl
1583,conceptual_asset,TOESCA GLOBAL EQUITIES FONDO DE INVERSIÓN,FINV-9498,investment_fund,,4,9498-6,http://www.cmfchile.cl
1579,conceptual_asset,QUEST RENTA LOCAL FONDO DE INVERSIÓN,FINV-9153,investment_fund,,4,9153-7,http://www.cmfchile.cl
2239,conceptual_asset,FONDO MUTUO BTG PACTUAL GESTION CONSERVADORA,FFMM-BTG-9116,mutual_fund,CLP,4,9116-2,http://www.cmfchile.cl
1937,conceptual_asset,FONDO MUTUO SANTANDER DEUDA LATAM,FFMM-SANTANDER-8906,mutual_fund,CLP,4,8906-0,http://www.cmfchile.cl
1743,conceptual_asset,FONDO MUTUO BTG PACTUAL RENTA LOCAL,FFMM-BTG-8897,mutual_fund,CLP,4,8897-8,http://www.cmfchile.cl
1744,conceptual_asset,FONDO MUTUO BTG PACTUAL RENTA NOMINAL,FFMM-BTG-8358,mutual_fund,CLP,4,8358-5,http://www.cmfchile.cl
1810,conceptual_asset,FONDO MUTUO ZURICH PERFIL MODERADO,FFMM-ZURICH-9577,mutual_fund,,4,9577-k,http://www.cmfchile.cl
1581,conceptual_asset,SENSOR EQUITY TRADING FONDO DE INVERSION,FINV-9604,investment_fund,,4,9604-0,http://www.cmfchile.cl
1811,conceptual_asset,FONDO MUTUO ZURICH PROYECCIÓN A,FFMM-ZURICH-8694,mutual_fund,CLP,4,8694-0,http://www.cmfchile.cl
1812,conceptual_asset,FONDO MUTUO ZURICH PROYECCIÓN C,FFMM-ZURICH-8695,mutual_fund,CLP,4,8695-9,http://www.cmfchile.cl
1582,conceptual_asset,TOESCA EMERGING MARKETS EQUITIES FONDO DE INVERSION,FINV-9499,investment_fund,,4,9499-4,http://www.cmfchile.cl
2078,conceptual_asset,FONDO MUTUO ZURICH VALOR,FFMM-ZURICH-9426,mutual_fund,CLP,4,9426-9,http://www.cmfchile.cl
2063,conceptual_asset,FONDO MUTUO ZURICH BURSÁTIL 90,FFMM-ZURICH-8395,mutual_fund,,4,8395-k,http://www.cmfchile.cl
1842,conceptual_asset,FONDO MUTUO ITAU EMERGING EQUITIES,FFMM-ITAU-8379,mutual_fund,CLP,4,8379-8,http://www.cmfchile.cl
1924,conceptual_asset,FONDO MUTUO SANTANDER ACCIONES EUROPA,FFMM-SANTANDER-9254,mutual_fund,CLP,4,9254-1,http://www.cmfchile.cl
1932,conceptual_asset,FONDO MUTUO SANTANDER AHORRO MEDIANO PLAZO,FFMM-SANTANDER-9222,mutual_fund,CLP,4,9222-3,http://www.cmfchile.cl
1938,conceptual_asset,FONDO MUTUO SANTANDER DEUDA LATAM DOLAR,FFMM-SANTANDER-9352,mutual_fund,USD,4,9352-1,http://www.cmfchile.cl
1942,conceptual_asset,FONDO MUTUO SANTANDER GESTIÓN ACTIVA EQUILIBRIO,FFMM-SANTANDER-9646,mutual_fund,CLP,4,9646-6,http://www.cmfchile.cl
1941,conceptual_asset,FONDO MUTUO SANTANDER GESTIÓN ACTIVA AGRESIVA,FFMM-SANTANDER-9648,mutual_fund,CLP,4,9648-2,http://www.cmfchile.cl
2562,conceptual_asset,FONDO MUTUO SECURITY LATINOAMERICANO,FFMM-ADMINISTRADORA-8524,mutual_fund,,4,8524-3,http://www.cmfchile.cl
2563,conceptual_asset,FONDO MUTUO SECURITY 9,FFMM-ADMINISTRADORA-8523,mutual_fund,,4,8523-5,http://www.cmfchile.cl
2564,conceptual_asset,FONDO MUTUO SECURITY ACCIONES,FFMM-ADMINISTRADORA-8069,mutual_fund,,4,8069-1,http://www.cmfchile.cl
2565,conceptual_asset,FONDO MUTUO SECURITY ACCIONES MID – SMALL CHILE CHILE,FFMM-ADMINISTRADORA-8307,mutual_fund,,4,8307-0,http://www.cmfchile.cl
2573,conceptual_asset,FONDO MUTUO SECURITY DEUDA LOCAL,FFMM-ADMINISTRADORA-8697,mutual_fund,,4,8697-5,http://www.cmfchile.cl
2076,conceptual_asset,FONDO MUTUO ZURICH SELECT GLOBAL,FFMM-ZURICH-8621,mutual_fund,CLP,4,8621-5,http://www.cmfchile.cl
1584,conceptual_asset,TOESCA GLOBAL YIELD FONDO DE INVERSION,FINV-9496,investment_fund,,4,9496-k,http://www.cmfchile.cl
2559,conceptual_asset,FONDO MUTUO SECOND BEST CHILE EE.UU. GARANTIZADO,FFMM-BANCHILE-8963,mutual_fund,,4,8963-k,http://www.cmfchile.cl
1580,conceptual_asset,SECURITY FIXED INCOME LATAM FONDO DE INVERSIÓN,FINV-7284,investment_fund,,4,7284-2,http://www.cmfchile.cl
1624,conceptual_asset,FONDO MUTUO BANCOESTADO BNP PARIBAS RENTA EMERGENTE,FFMM-BANCOESTADO-8753,mutual_fund,,4,8753-k,http://www.cmfchile.cl
1944,conceptual_asset,FONDO MUTUO SANTANDER GESTIÓN ACTIVA RETORNO,FFMM-SANTANDER-9647,mutual_fund,CLP,4,9647-4,http://www.cmfchile.cl
2558,conceptual_asset,FONDO MUTUO SCOTIA VALORIZA,FFMM-SCOTIA-8110,mutual_fund,,4,8110-8,http://www.cmfchile.cl
1974,conceptual_asset,FONDO MUTUO SCOTIA DISPONIBLE,FFMM-SCOTIA-8104,mutual_fund,CLP,4,8104-3,http://www.cmfchile.cl
1978,conceptual_asset,FONDO MUTUO SCOTIA FUTURO,FFMM-SCOTIA-8105,mutual_fund,CLP,4,8105-1,http://www.cmfchile.cl
1963,conceptual_asset,FONDO MUTUO SCOTIA PORTAFOLIO ARRIESGADO,FFMM-SCOTIA-8116,mutual_fund,CLP,4,8116-7,http://www.cmfchile.cl
1973,conceptual_asset,FONDO MUTUO SCOTIA CORPORATIVO,FFMM-SCOTIA-8117,mutual_fund,CLP,4,8117-5,http://www.cmfchile.cl
1986,conceptual_asset,FONDO MUTUO SCOTIA MILA,FFMM-SCOTIA-8858,mutual_fund,CLP,4,8858-7,http://www.cmfchile.cl
1969,conceptual_asset,FONDO MUTUO SCOTIA DEUDA LATAM DOLAR,FFMM-SCOTIA-8244,mutual_fund,USD,4,8244-9,http://www.cmfchile.cl
1977,conceptual_asset,FONDO MUTUO SCOTIA DEUDA MEDIANO PLAZO UF,FFMM-SCOTIA-8106,mutual_fund,,4,8106-k,http://www.cmfchile.cl
2641,conceptual_asset,FONDO MUTUO BCI ESTRUCTURADO ESTRATEGIA DEUDA PLUS,FFMM-BCI-9727,mutual_fund,,4,9727-6,http://www.cmfchile.cl
1626,conceptual_asset,FONDO MUTUO BANCOESTADO PERFIL A,FFMM-BANCOESTADO-8844,mutual_fund,CLP,4,8844-7,http://www.cmfchile.cl
