id,type,name,symbol,category,currency,max_scale,run,data_source
2376,conceptual_asset,FONDO MUTUO ITAU OPORTUNIDAD,FFMM-ITAU-8156,mutual_fund,,4,8156-6,http://www.cmfchile.cl
2377,conceptual_asset,FONDO MUTUO ITAU OPORTUNIDAD DOLAR,FFMM-ITAU-8648,mutual_fund,,4,8648-7,http://www.cmfchile.cl
1806,conceptual_asset,FONDO MUTUO ZURICH MERCADOS EMERGENTES,FFMM-ZURICH-8277,mutual_fund,CLP,4,8277-5,http://www.cmfchile.cl
1802,conceptual_asset,FONDO MUTUO ZURICH EXPERTO,FFMM-ZURICH-8455,mutual_fund,CLP,4,8455-7,http://www.cmfchile.cl
1801,conceptual_asset,FONDO MUTUO ZURICH EUROPA,FFMM-ZURICH-8456,mutual_fund,CLP,4,8456-5,http://www.cmfchile.cl
1803,conceptual_asset,FONDO MUTUO ZURICH GESTION CONSERVADORA,FFMM-ZURICH-8805,mutual_fund,CLP,4,8805-6,http://www.cmfchile.cl
1804,conceptual_asset,FONDO MUTUO ZURICH HIGH YIELD LATAM,FFMM-ZURICH-8946,mutual_fund,CLP,4,8946-k,http://www.cmfchile.cl
1499,conceptual_asset,FONDO DE INVERSION SANTANDER DEUDA CORPORATIVA CHILE,FINV-9348,investment_fund,,4,9348-3,http://www.cmfchile.cl
2046,conceptual_asset,FONDO MUTUO SURA RENTA CORPORATIVA LARGO PLAZO,FFMM-ADMINISTRADORA-8956,mutual_fund,CLP,4,8956-7,http://www.cmfchile.cl
2043,conceptual_asset,FONDO MUTUO SURA RENTA ACTIVA CHILE,FFMM-ADMINISTRADORA-9003,mutual_fund,CLP,4,9003-4,http://www.cmfchile.cl
1508,conceptual_asset,FONDO DE INVERSIÓN CREDICORP CAPITAL LATIN AMERICAN EQUITY,FINV-9623,investment_fund,,4,9623-7,http://www.cmfchile.cl
2640,conceptual_asset,FONDO DE INVERSIÓN SURA ACCIONES GLOBALES,FINV-9679,investment_fund,,4,9679-2,http://www.cmfchile.cl
1500,conceptual_asset,FONDO DE INVERSION SANTANDER RENTA VARIABLE GLOBAL,FINV-9540,investment_fund,,4,9540-0,http://www.cmfchile.cl
1753,conceptual_asset,FONDO MUTUO COMPASS INVESTMENT GRADE LATAM,FFMM-COMPASS-9345,mutual_fund,,4,9345-9,http://www.cmfchile.cl
1751,conceptual_asset,FONDO MUTUO COMPASS DEUDA CHILENA,FFMM-COMPASS-9072,mutual_fund,,4,9072-7,http://www.cmfchile.cl
1504,conceptual_asset,FONDO DE INVERSIÓN CREDICORP CAPITAL ACCIONES US,FINV-9250,investment_fund,,4,9250-9,http://www.cmfchile.cl
2378,conceptual_asset,FONDO MUTUO ITAU PERFIL AGRESIVO,FFMM-ITAU-9012,mutual_fund,,4,9012-3,http://www.cmfchile.cl
2970,conceptual_asset,CNRG,CNRG,etf,USD,4,,
1503,conceptual_asset,FONDO DE INVERSIÓN BCI SOCIEDAD MATRIZ,FINV-9143,investment_fund,,4,9143-k,http://www.cmfchile.cl
1502,conceptual_asset,FONDO DE INVERSION SURA DEUDA CHILE LARGO PLAZO,FINV-9444,investment_fund,,4,9444-7,http://www.cmfchile.cl
61,conceptual_asset,EMB,EMB,etf,USD,4,,
3075,conceptual_asset,FONDO MUTUO BICE ESTRUCTURADO UF,FFMM-BICE-10176,mutual_fund,,4,10176-1,http://www.cmfchile.cl
60,conceptual_asset,VEA,VEA,etf,USD,4,,
2972,conceptual_asset,FONDO DE INVERSIÓN HMC DEUDA PRIVADA PESOS,FINV-10007,investment_fund,,4,10007-2,http://www.cmfchile.cl
1630,conceptual_asset,FONDO MUTUO BCI ACCIONES CHILENAS,FFMM-BCI-8430,mutual_fund,CLP,4,8430-1,http://www.cmfchile.cl
2919,conceptual_asset,TOESCA DEUDA PRIVADA FACTURAS FONDO DE INVERSIÓN,FINV-9970,investment_fund,CLP,4,9970-8,http://www.cmfchile.cl
3073,conceptual_asset,FONDO MUTUO BTG PACTUAL ESTRUCTURADO PROTECCIÓN UF,FFMM-BTG-10169,mutual_fund,,4,10169-9,http://www.cmfchile.cl
3074,conceptual_asset,FONDO DE INVERSIÓN FALCOM DEUDA CORPORATIVA CHILE,FINV-9902,investment_fund,,4,9902-3,http://www.cmfchile.cl
2986,conceptual_asset,FONDO MUTUO BICE TEMÁTICO GLOBAL,FFMM-BICE-10009,mutual_fund,,4,10009-9,http://www.cmfchile.cl
2987,conceptual_asset,FONDO MUTUO BOOSTER CLEAN ENERGY,FFMM-BANCHILE-10034,mutual_fund,,4,10034-k,http://www.cmfchile.cl
1506,conceptual_asset,FONDO MUTUO CREDICORP CAPITAL DEUDA CORPORATIVA INVESTMENT GRADE,FFMM-CREDICORP-9251,mutual_fund,,4,9251-7,http://www.cmfchile.cl
3110,conceptual_asset,FONDO MUTUO BICE BALANCEADO GLOBAL DÓLAR,FFMM-BICE-10184,mutual_fund,,4,10184-2,http://www.cmfchile.cl
2743,conceptual_asset,ESGV,ESGV,etf,USD,4,,
3077,conceptual_asset,MBI DEUDA CORPORATIVA FONDO DE INVERSIÓN,FINV-10162,investment_fund,,4,10162-1,http://www.cmfchile.cl
2988,conceptual_asset,FONDO MUTUO BOOSTER INNOVATION,FFMM-BANCHILE-10085,mutual_fund,,4,10085-4,http://www.cmfchile.cl
64,conceptual_asset,VTI,VTI,etf,USD,4,,
2382,conceptual_asset,FONDO MUTUO ITAU SELECTO GLOBAL,FFMM-ITAU-8589,mutual_fund,,4,8589-8,http://www.cmfchile.cl
1769,conceptual_asset,FONDO MUTUO CREDICORP CAPITAL ACCIONES ESTRATEGICAS,FFMM-CREDICORP-8982,mutual_fund,CLP,4,8982-6,http://www.cmfchile.cl
1794,conceptual_asset,FONDO MUTUO ZURICH ACCIONES LATAM,FFMM-ZURICH-8247,mutual_fund,CLP,4,8247-3,http://www.cmfchile.cl
2971,conceptual_asset,ESPO,ESPO,etf,USD,4,,
1507,conceptual_asset,FONDO DE INVERSIÓN CREDICORP CAPITAL E PLUS,FINV-9108,investment_fund,,4,9108-1,http://www.cmfchile.cl
62,conceptual_asset,IVV,IVV,etf,USD,4,,
1514,conceptual_asset,FONDO DE INVERSIÓN ZURICH DEUDA ARGENTINA,FINV-9554,investment_fund,,4,9554-0,http://www.cmfchile.cl
1771,conceptual_asset,FONDO MUTUO CREDICORP CAPITAL DEUDA 360,FFMM-CREDICORP-9056,mutual_fund,CLP,4,9056-5,http://www.cmfchile.cl
2383,conceptual_asset,FONDO MUTUO ITAU USA,FFMM-ITAU-8233,mutual_fund,,4,8233-3,http://www.cmfchile.cl
2384,conceptual_asset,FONDO MUTUO ITAÚ CAPITAL,FFMM-ITAU-8623,mutual_fund,,4,8623-1,http://www.cmfchile.cl
2385,conceptual_asset,FONDO MUTUO ITAÚ DOLLAR,FFMM-ITAU-8236,mutual_fund,,4,8236-8,http://www.cmfchile.cl
2386,conceptual_asset,FONDO MUTUO ITAÚ GESTIONADO ACCIONES,FFMM-ITAU-8960,mutual_fund,,4,8960-5,http://www.cmfchile.cl
2387,conceptual_asset,FONDO MUTUO ITAÚ GESTIONADO AGRESIVO,FFMM-ITAU-8925,mutual_fund,,4,8925-7,http://www.cmfchile.cl
2388,conceptual_asset,FONDO MUTUO ITAÚ GESTIONADO CONSERVADOR,FFMM-ITAU-8927,mutual_fund,,4,8927-3,http://www.cmfchile.cl
2389,conceptual_asset,FONDO MUTUO ITAÚ GESTIONADO CONSERVADOR DOLAR,FFMM-ITAU-8521,mutual_fund,,4,8521-9,http://www.cmfchile.cl
2989,conceptual_asset,FONDO MUTUO BTG PACTUAL AUDAZ OJOS DEL SALADO,FFMM-BTG-10030,mutual_fund,,4,10030-7,http://www.cmfchile.cl
1800,conceptual_asset,FONDO MUTUO ZURICH ESG LATAM,FFMM-ZURICH-9625,mutual_fund,,4,9625-3,http://www.cmfchile.cl
2990,conceptual_asset,FONDO MUTUO BTG PACTUAL AVENTURERO CERRO EL PLOMO,FFMM-BTG-10032,mutual_fund,,4,10032-3,http://www.cmfchile.cl
1808,conceptual_asset,FONDO MUTUO ZURICH PERFIL AGRESIVO,FFMM-ZURICH-9576,mutual_fund,CLP,4,9576-1,http://www.cmfchile.cl
1509,conceptual_asset,FONDO DE INVERSIÓN CREDICORP CAPITAL PACIFIC ALLIANCE EQUITY,FINV-9155,investment_fund,,4,9155-3,http://www.cmfchile.cl
1505,conceptual_asset,FONDO DE INVERSIÓN CREDICORP CAPITAL ALLIANZ GLOBAL EQUITIES,FINV-9582,investment_fund,,4,9582-6,http://www.cmfchile.cl
2023,conceptual_asset,FONDO MUTUO SECURITY LATAM,FFMM-ADMINISTRADORA-8795,mutual_fund,,4,8795-5,http://www.cmfchile.cl
63,conceptual_asset,VOO,VOO,etf,USD,4,,
65,conceptual_asset,DSI,DSI,etf,USD,4,,
50,conceptual_asset,IWM,IWM,etf,USD,4,,
51,conceptual_asset,HYG,HYG,etf,USD,4,,
52,conceptual_asset,VWO,VWO,etf,USD,4,,
55,conceptual_asset,LQD,LQD,etf,USD,4,,
2994,conceptual_asset,FONDO MUTUO ITAU MI CARTERA EXPLORADORA,FFMM-ITAU-10021,mutual_fund,,4,10021-8,http://www.cmfchile.cl
2991,conceptual_asset,FONDO MUTUO BTG PACTUAL PRECAVIDO CERRO MANQUEHUE,FFMM-BTG-10031,mutual_fund,,4,10031-5,http://www.cmfchile.cl
53,conceptual_asset,EWJ,EWJ,etf,USD,4,,
1776,conceptual_asset,FONDO MUTUO CREDICORP CAPITAL MACRO CLP 1.5,FFMM-CREDICORP-9310,mutual_fund,CLP,4,9310-6,http://www.cmfchile.cl
1773,conceptual_asset,FONDO MUTUO CREDICORP CAPITAL GLOBALES I,FFMM-CREDICORP-8427,mutual_fund,CLP,4,8427-1,http://www.cmfchile.cl
54,conceptual_asset,JNK,JNK,etf,USD,4,,
1512,conceptual_asset,FONDO DE INVERSIÓN ETF SINGULAR CHILE CORPORATIVO,FINV-9705,investment_fund,CLP,4,9705-5,http://www.cmfchile.cl
1775,conceptual_asset,FONDO MUTUO CREDICORP CAPITAL LIQUIDEZ,FFMM-CREDICORP-8401,mutual_fund,CLP,4,8401-8,http://www.cmfchile.cl
57,conceptual_asset,VNQ,VNQ,etf,USD,4,,
58,conceptual_asset,ACWI,ACWI,etf,USD,4,,
1778,conceptual_asset,FONDO MUTUO CREDICORP CAPITAL RENTA ESTRATEGICA,FFMM-CREDICORP-8421,mutual_fund,CLP,4,8421-2,http://www.cmfchile.cl
2992,conceptual_asset,FONDO MUTUO ITAU LARRAINVIAL AHORRO DOLAR,FFMM-ITAU-10027,mutual_fund,,4,10027-7,http://www.cmfchile.cl
1523,conceptual_asset,FONDO DE INVERSIÓN FALCOM LATINOAMERICA DEUDA LOCAL,FINV-9085,investment_fund,,4,9085-9,http://www.cmfchile.cl
1809,conceptual_asset,FONDO MUTUO ZURICH PERFIL CONSERVADOR,FFMM-ZURICH-9575,mutual_fund,CLP,4,9575-3,http://www.cmfchile.cl
1513,conceptual_asset,FONDO DE INVERSIÓN ETF SINGULAR GLOBAL EQUITIES,FINV-9706,investment_fund,,4,9706-3,http://www.cmfchile.cl
1511,conceptual_asset,FONDO DE INVERSIÓN CREDICORP CAPITAL SMALL CAP,FINV-7176,investment_fund,,4,7176-5,http://www.cmfchile.cl
56,conceptual_asset,BND,BND,etf,USD,4,,
1522,conceptual_asset,FONDO DE INVERSIÓN FALCOM GLOBAL STRATEGY FUND,FINV-9297,investment_fund,,4,9297-5,http://www.cmfchile.cl
1510,conceptual_asset,FONDO DE INVERSIÓN CREDICORP CAPITAL RF LATAM,FINV-7225,investment_fund,,4,7225-7,http://www.cmfchile.cl
2993,conceptual_asset,FONDO MUTUO ITAU MI CARTERA AVENTURERA,FFMM-ITAU-10063,mutual_fund,,4,10063-3,http://www.cmfchile.cl
1777,conceptual_asset,FONDO MUTUO CREDICORP CAPITAL MONEY MARKET,FFMM-CREDICORP-8945,mutual_fund,USD,4,8945-1,http://www.cmfchile.cl
1524,conceptual_asset,FONDO DE INVERSIÓN FALCOM TACTICAL CHILEAN EQUITIES,FINV-9194,investment_fund,,4,9194-4,http://www.cmfchile.cl
1521,conceptual_asset,FONDO DE INVERSIÓN FALCOM GLOBAL EQUITY FUND,FINV-9674,investment_fund,,4,9674-1,http://www.cmfchile.cl
1682,conceptual_asset,FONDO MUTUO BCI TOP PICKS,FFMM-BCI-8787,mutual_fund,CLP,4,8787-4,http://www.cmfchile.cl
1816,conceptual_asset,FONDO MUTUO ZURICH RENTA A PLAZO,FFMM-ZURICH-8363,mutual_fund,CLP,4,8363-1,http://www.cmfchile.cl
1814,conceptual_asset,FONDO MUTUO ZURICH RENDIMIENTO NOMINAL,FFMM-ZURICH-8411,mutual_fund,CLP,4,8411-5,http://www.cmfchile.cl
1815,conceptual_asset,FONDO MUTUO ZURICH RENDIMIENTO UF,FFMM-ZURICH-8853,mutual_fund,CLP,4,8853-6,http://www.cmfchile.cl
1817,conceptual_asset,FONDO MUTUO ZURICH RENTA CHILENA,FFMM-ZURICH-9025,mutual_fund,CLP,4,9025-5,http://www.cmfchile.cl
2995,conceptual_asset,FONDO MUTUO ITAU MI CARTERA LANZADA,FFMM-ITAU-10064,mutual_fund,,4,10064-1,http://www.cmfchile.cl
1779,conceptual_asset,FONDO MUTUO CREDICORP CAPITAL RENTA INTERNACIONAL,FFMM-CREDICORP-8442,mutual_fund,CLP,4,8442-5,http://www.cmfchile.cl
2997,conceptual_asset,FONDO MUTUO LARRAINVIAL CUENTA ACTIVA AGRESIVA DÓLAR,FFMM-LARRAINVIAL-10002,mutual_fund,,4,10002-1,http://www.cmfchile.cl
2999,conceptual_asset,FONDO MUTUO SANTANDER EQUILIBRIO DÓLAR,FFMM-SANTANDER-10024,mutual_fund,,4,10024-2,http://www.cmfchile.cl
2996,conceptual_asset,FONDO MUTUO ITAU MI CARTERA TRANQUI,FFMM-ITAU-10020,mutual_fund,,4,10020-k,http://www.cmfchile.cl
3000,conceptual_asset,FONDO MUTUO SECURITY QFUND BRAZIL,FFMM-ADMINISTRADORA-10000,mutual_fund,,4,10000-5,http://www.cmfchile.cl
2318,conceptual_asset,FONDO MUTUO EUROAMERICA GARANTIZADO NORTEAMÉRICA 100,FFMM-ZURICH-8665,mutual_fund,,4,8665-7,http://www.cmfchile.cl
2320,conceptual_asset,FONDO MUTUO EUROAMERICA DESARROLLO SUSTENTABLE,FFMM-ZURICH-8607,mutual_fund,,4,8607-k,http://www.cmfchile.cl
2321,conceptual_asset,FONDO MUTUO EUROAMERICA DÓLAR,FFMM-ZURICH-8417,mutual_fund,,4,8417-4,http://www.cmfchile.cl
2322,conceptual_asset,FONDO MUTUO EUROAMERICA INVESTMENTS DEUDA,FFMM-ZURICH-8961,mutual_fund,,4,8961-3,http://www.cmfchile.cl
1813,conceptual_asset,FONDO MUTUO ZURICH PROYECCIÓN E,FFMM-ZURICH-8696,mutual_fund,CLP,4,8696-7,http://www.cmfchile.cl
1818,conceptual_asset,FONDO MUTUO ZURICH SMALL CAP LATAM,FFMM-ZURICH-8948,mutual_fund,CLP,4,8948-6,http://www.cmfchile.cl
2998,conceptual_asset,FONDO MUTUO SANTANDER FUTURE WEALTH,FFMM-SANTANDER-10057,mutual_fund,,4,10057-9,http://www.cmfchile.cl
3001,conceptual_asset,FONDO MUTUO ZURICH TENDENCIAS GLOBALES,FFMM-ZURICH-10036,mutual_fund,,4,10036-6,http://www.cmfchile.cl
1547,conceptual_asset,FONDO DE INVERSIÓN SARTOR TACTICO,FINV-9373,investment_fund,CLP,4,9373-4,http://www.cmfchile.cl
2017,conceptual_asset,FONDO MUTUO SECURITY FIRST,FFMM-ADMINISTRADORA-8055,mutual_fund,CLP,4,8055-1,http://www.cmfchile.cl
2029,conceptual_asset,FONDO MUTUO SECURITY PROTECCION ESTRATEGICO,FFMM-ADMINISTRADORA-8306,mutual_fund,CLP,4,8306-2,http://www.cmfchile.cl
1926,conceptual_asset,FONDO MUTUO SANTANDER ACCIONES GLOBAL EMERGENTE,FFMM-SANTANDER-8058,mutual_fund,CLP,4,8058-6,http://www.cmfchile.cl
3007,conceptual_asset,FONDO MUTUO BANCHILE AGRESIVO,FFMM-BANCHILE-10058,mutual_fund,,4,10058-7,http://www.cmfchile.cl
1930,conceptual_asset,FONDO MUTUO SANTANDER ACCIONES SELECTAS CHILE,FFMM-SANTANDER-8372,mutual_fund,CLP,4,8372-0,http://www.cmfchile.cl
1921,conceptual_asset,FONDO MUTUO SANTANDER A,FFMM-SANTANDER-8577,mutual_fund,CLP,4,8577-4,http://www.cmfchile.cl
1943,conceptual_asset,FONDO MUTUO SANTANDER GESTIÓN ACTIVA PRUDENTE,FFMM-SANTANDER-9649,mutual_fund,CLP,4,9649-0,http://www.cmfchile.cl
2737,conceptual_asset,FONDO MUTUO ARRIESGADO FOCUS,FFMM-SOYFOCUS-9811,mutual_fund,CLP,4,9811-6,http://www.cmfchile.cl
3012,conceptual_asset,FONDO MUTUO BANCHILE PORTAFOLIO ACTIVO DOLAR MODERADO,FFMM-BANCHILE-10111,mutual_fund,,4,10111-7,http://www.cmfchile.cl
3016,conceptual_asset,KOMP,KOMP,etf,USD,4,,
3008,conceptual_asset,FONDO MUTUO BANCHILE CONSERVADOR,FFMM-BANCHILE-10059,mutual_fund,,4,10059-5,http://www.cmfchile.cl
1609,conceptual_asset,FONDO DE INVERSIÓN SECURITY EUROPA PROTEGIDO,FINV-9124,investment_fund,,4,9124-3,http://www.cmfchile.cl
1608,conceptual_asset,FONDO DE INVERSIÓN SECURITY EMERGENTE PROTEGIDO,FINV-9126,investment_fund,,4,9126-k,http://www.cmfchile.cl
2011,conceptual_asset,FONDO MUTUO SECURITY DEUDA CORPORATIVA LATINOAMERICANA I.G.,FFMM-ADMINISTRADORA-9073,mutual_fund,,4,9073-5,http://www.cmfchile.cl
3013,conceptual_asset,QUEST GLOBAL VALUE FONDO DE INVERSION,FINV-10081,investment_fund,,4,10081-1,http://www.cmfchile.cl
3009,conceptual_asset,FONDO MUTUO BANCHILE MODERADO,FFMM-BANCHILE-10060,mutual_fund,,4,10060-9,http://www.cmfchile.cl
535,conceptual_asset,SPC UF 2Y,SPC-UF-2Y,rate,UF,4,,https://www.bcentral.cl
536,conceptual_asset,SPC UF 3Y,SPC-UF-3Y,rate,UF,4,,https://www.bcentral.cl
3005,conceptual_asset,FONDO MUTUO LARRAINVIAL DEUDA CHINA,FFMM-LARRAINVIAL-10066,mutual_fund,,4,10066-8,http://www.cmfchile.cl
3002,conceptual_asset,FONDO MUTUO BICE SMART AUDAZ,FFMM-BICE-10049,mutual_fund,,4,10049-8,http://www.cmfchile.cl
3003,conceptual_asset,FONDO MUTUO BICE SMART ENTUSIASTA,FFMM-BICE-10048,mutual_fund,,4,10048-k,http://www.cmfchile.cl
3004,conceptual_asset,FONDO MUTUO BICE SMART PRUDENTE,FFMM-BICE-10050,mutual_fund,,4,10050-1,http://www.cmfchile.cl
3006,conceptual_asset,FONDO MUTUO ETF IT NOW S&P IPSA ESG,FFMM-ITAU-10068,mutual_fund,,4,10068-4,http://www.cmfchile.cl
537,conceptual_asset,SPC UF 4Y,SPC-UF-4Y,rate,UF,4,,https://www.bcentral.cl
538,conceptual_asset,SPC UF 5Y,SPC-UF-5Y,rate,UF,4,,https://www.bcentral.cl
3010,conceptual_asset,FONDO MUTUO BANCHILE RENTA LARGO PLAZO,FFMM-BANCHILE-10061,mutual_fund,,4,10061-7,http://www.cmfchile.cl
3011,conceptual_asset,FONDO MUTUO CLEVER TOP TECH,FFMM-BICE-10109,mutual_fund,,4,10109-5,http://www.cmfchile.cl
539,conceptual_asset,SPC UF 10Y,SPC-UF-10Y,rate,UF,4,,https://www.bcentral.cl
3015,conceptual_asset,FONDO MUTUO BICE RENTA GLOBAL AHORRO DÓLAR,FFMM-BICE-10125,mutual_fund,,4,10125-7,http://www.cmfchile.cl
2748,conceptual_asset,FYNSA TOTAL RETURN FONDO DE INVERSIÓN,FINV-9820,investment_fund,,4,9820-5,http://www.cmfchile.cl
540,conceptual_asset,SPC UF 20Y,SPC-UF-20Y,rate,UF,4,,https://www.bcentral.cl
529,conceptual_asset,SPC CLP 2Y,SPC-CLP-2Y,rate,CLP,4,,https://www.bcentral.cl
1923,conceptual_asset,FONDO MUTUO SANTANDER ACCIONES CHILENAS,FFMM-SANTANDER-8076,mutual_fund,CLP,4,8076-4,http://www.cmfchile.cl
1770,conceptual_asset,FONDO DE INVERSION CREDICORP CAPITAL ARGENTINA LIQUIDEZ,FFMM-CREDICORP-9535,mutual_fund,,4,9535-4,http://www.cmfchile.cl
3014,conceptual_asset,AMERIS DVA CONSERVADOR FONDO DE INVERSION,FINV-10074,investment_fund,,4,10074-9,http://www.cmfchile.cl
3050,conceptual_asset,FONDO MUTUO CREDICORP CAPITAL SHORT DURATION LATAM,FFMM-CREDICORP-10087,mutual_fund,,4,10087-0,http://www.cmfchile.cl
1747,conceptual_asset,FONDO MUTUO BANCHILE CAPITAL FINANCIERO,FFMM-BANCHILE-8026,mutual_fund,CLP,4,8026-8,http://www.cmfchile.cl
1767,conceptual_asset,FONDO MUTUO BANCHILE CORPORATE DOLLAR,FFMM-BANCHILE-8248,mutual_fund,USD,4,8248-1,http://www.cmfchile.cl
1829,conceptual_asset,FONDO MUTUO BANCHILE INVERSIONES ALTERNATIVAS,FFMM-BANCHILE-9294,mutual_fund,CLP,4,9294-0,http://www.cmfchile.cl
1722,conceptual_asset,FONDO MUTUO BOOSTER ACCIONES EMERGENTES III,FFMM-BANCHILE-9673,mutual_fund,CLP,4,9673-3,http://www.cmfchile.cl
2792,conceptual_asset,FONDO MUTUO BEST COUPON USA,FFMM-BANCHILE-9884,mutual_fund,,4,9884-1,http://www.cmfchile.cl
1723,conceptual_asset,FONDO MUTUO BOOSTER ACCIONES EUROPA III,FFMM-BANCHILE-9672,mutual_fund,CLP,4,9672-5,http://www.cmfchile.cl
2835,conceptual_asset,FONDO DE INVERSIÓN BANCHILE MARKETPLUS GLOBAL,FINV-9332,investment_fund,,4,9332-7,http://www.cmfchile.cl
2084,conceptual_asset,FONDO MUTUO AHORRO ESTABLE I GARANTIZADO,FFMM-BANCHILE-8868,mutual_fund,,4,8868-4,http://www.cmfchile.cl
2828,conceptual_asset,FONDO MUTUO BANCHILE GLOBAL HIGH YIELD,FFMM-BANCHILE-9859,mutual_fund,,4,9859-0,http://www.cmfchile.cl
2085,conceptual_asset,FONDO MUTUO AHORRO ESTABLE II GARANTIZADO,FFMM-BANCHILE-8905,mutual_fund,,4,8905-2,http://www.cmfchile.cl
2086,conceptual_asset,FONDO MUTUO AHORRO ESTABLE III GARANTIZADO,FFMM-BANCHILE-8919,mutual_fund,,4,8919-2,http://www.cmfchile.cl
2087,conceptual_asset,FONDO MUTUO AHORRO PLUS I GARANTIZADO,FFMM-BANCHILE-8871,mutual_fund,,4,8871-4,http://www.cmfchile.cl
2090,conceptual_asset,FONDO MUTUO AMERICA LATINA ACCIONARIO,FFMM-BANCHILE-8086,mutual_fund,,4,8086-1,http://www.cmfchile.cl
2091,conceptual_asset,FONDO MUTUO BAMBÚ GARANTIZADO,FFMM-BANCHILE-8418,mutual_fund,,4,8418-2,http://www.cmfchile.cl
2092,conceptual_asset,FONDO MUTUO BANCA AMERICANA VOLTARGET GARANTIZADO,FFMM-BANCHILE-8782,mutual_fund,,4,8782-3,http://www.cmfchile.cl
2093,conceptual_asset,FONDO MUTUO BANCHILE ESTRATEGICO,FFMM-BANCHILE-8120,mutual_fund,,4,8120-5,http://www.cmfchile.cl
2094,conceptual_asset,FONDO MUTUO BANCHILE GARANTIZADO 112,FFMM-BANCHILE-8353,mutual_fund,,4,8353-4,http://www.cmfchile.cl
2095,conceptual_asset,FONDO MUTUO BANCHILE GARANTIZADO PLUS,FFMM-BANCHILE-8283,mutual_fund,,4,8283-k,http://www.cmfchile.cl
2096,conceptual_asset,FONDO MUTUO BANCHILE UTILIDADES GLOBALES,FFMM-BANCHILE-8122,mutual_fund,,4,8122-1,http://www.cmfchile.cl
2834,conceptual_asset,FONDO DE INVERSIÓN BANCHILE MARKETPLUS DEUDA GLOBAL,FINV-9318,investment_fund,,4,9318-1,http://www.cmfchile.cl
3017,conceptual_asset,TIP,TIP,etf,USD,4,,
2832,conceptual_asset,FONDO DE INVERSIÓN BANCHILE EMERGING DEBT,FINV-9778,investment_fund,,4,9778-0,http://www.cmfchile.cl
2830,conceptual_asset,FONDO DE INVERSIÓN BANCHILE DEUDA CHILENA,FINV-9252,investment_fund,,4,9252-5,http://www.cmfchile.cl
2838,conceptual_asset,FONDO DE INVERSIÓN BANCHILE MARKETPLUS ESTADOS UNIDOS,FINV-9333,investment_fund,,4,9333-5,http://www.cmfchile.cl
2829,conceptual_asset,FONDO DE INVERSION BANCHILE CHILE BLEND.,FINV-7213,investment_fund,,4,7213-3,http://www.cmfchile.cl
2836,conceptual_asset,FONDO DE INVERSION BANCHILE MARKETPLUS EUROPA,FINV-9606,investment_fund,,4,9606-7,http://www.cmfchile.cl
2831,conceptual_asset,FONDO DE INVERSIÓN BANCHILE DEUDA ALTO RENDIMIENTO,FINV-9534,investment_fund,,4,9534-6,http://www.cmfchile.cl
2840,conceptual_asset,FONDO DE INVERSIÓN BANCHILE EMERGING EQUITY,FINV-9471,investment_fund,,4,9471-4,http://www.cmfchile.cl
2833,conceptual_asset,FONDO DE INVERSIÓN BANCHILE LATAM CORPORATE HIGH YIELD,FINV-9089,investment_fund,,4,9089-1,http://www.cmfchile.cl
2837,conceptual_asset,FONDO DE INVERSIÓN BANCHILE MARKETPLUS EMERGENTE,FINV-9661,investment_fund,,4,9661-k,http://www.cmfchile.cl
2839,conceptual_asset,FONDO DE INVERSIÓN BANCHILE ESTRATEGIAS ALTERNATIVAS,FINV-9470,investment_fund,,4,9470-6,http://www.cmfchile.cl
2445,conceptual_asset,FONDO MUTUO MI AHORRO,FFMM-LARRAINVIAL-8718,mutual_fund,,4,8718-1,http://www.cmfchile.cl
1674,conceptual_asset,FONDO MUTUO BCI PB US HIGH YIELD,FFMM-BCI-9456,mutual_fund,USD,4,9456-0,http://www.cmfchile.cl
2211,conceptual_asset,FONDO MUTUO BICE TENDENCIAS DEUDA,FFMM-BICE-9086,mutual_fund,CLP,4,9086-7,http://www.cmfchile.cl
1956,conceptual_asset,FONDO MUTUO SANTANDER SELECT DINAMICO,FFMM-SANTANDER-8996,mutual_fund,CLP,4,8996-6,http://www.cmfchile.cl
1957,conceptual_asset,FONDO MUTUO SANTANDER SELECT EQUILIBRIO,FFMM-SANTANDER-8995,mutual_fund,CLP,4,8995-8,http://www.cmfchile.cl
2277,conceptual_asset,FONDO MUTUO CORP INVESTMENT A,FFMM-ITAU-9011,mutual_fund,,4,9011-5,http://www.cmfchile.cl
2257,conceptual_asset,FONDO MUTUO CHILE GARANTIZADO,FFMM-BANCHILE-8382,mutual_fund,,4,8382-8,http://www.cmfchile.cl
2527,conceptual_asset,FONDO MUTUO SANTANDER PORTFOLIO MODERADO,FFMM-SANTANDER-8214,mutual_fund,,4,8214-7,http://www.cmfchile.cl
2529,conceptual_asset,FONDO MUTUO SANTANDER RENTAMAS,FFMM-SANTANDER-8056,mutual_fund,,4,8056-k,http://www.cmfchile.cl
1501,conceptual_asset,FONDO DE INVERSION SECURITY RENTA FIJA NACIONAL,FINV-9117,investment_fund,,4,9117-0,http://www.cmfchile.cl
2012,conceptual_asset,FONDO MUTUO SECURITY DEUDA INTERNACIONAL,FFMM-ADMINISTRADORA-9655,mutual_fund,,4,9655-5,http://www.cmfchile.cl
2014,conceptual_asset,FONDO MUTUO SECURITY EMERGING MARKET,FFMM-ADMINISTRADORA-8323,mutual_fund,,4,8323-2,http://www.cmfchile.cl
2135,conceptual_asset,FONDO MUTUO BBVA GARANTIZADO SELECCION CONSUMO,FFMM-SCOTIA-8810,mutual_fund,,4,8810-2,http://www.cmfchile.cl
2144,conceptual_asset,FONDO MUTUO BBVA JAPÓN,FFMM-SCOTIA-8483,mutual_fund,,4,8483-2,http://www.cmfchile.cl
2307,conceptual_asset,FONDO MUTUO DEUDA LOCAL,FFMM-ADMINISTRADORA-8904,mutual_fund,,4,8904-4,http://www.cmfchile.cl
2577,conceptual_asset,FONDO MUTUO SECURITY EMERGENTE,FFMM-ADMINISTRADORA-8453,mutual_fund,,4,8453-0,http://www.cmfchile.cl
2578,conceptual_asset,FONDO MUTUO SECURITY ENERGY FUND,FFMM-ADMINISTRADORA-8461,mutual_fund,,4,8461-1,http://www.cmfchile.cl
2579,conceptual_asset,FONDO MUTUO SECURITY ESTADOS UNIDOS,FFMM-ADMINISTRADORA-8500,mutual_fund,,4,8500-6,http://www.cmfchile.cl
2580,conceptual_asset,FONDO MUTUO SECURITY EURO BOND,FFMM-ADMINISTRADORA-8337,mutual_fund,,4,8337-2,http://www.cmfchile.cl
2581,conceptual_asset,FONDO MUTUO SECURITY EVOLUCIÓN CHILE,FFMM-ADMINISTRADORA-8958,mutual_fund,,4,8958-3,http://www.cmfchile.cl
2583,conceptual_asset,FONDO MUTUO SECURITY EXPLORER,FFMM-ADMINISTRADORA-8165,mutual_fund,,4,8165-5,http://www.cmfchile.cl
2582,conceptual_asset,FONDO MUTUO SECURITY EXPLORER,FFMM-ADMINISTRADORA-8361,mutual_fund,,4,8361-5,http://www.cmfchile.cl
2018,conceptual_asset,FONDO MUTUO SECURITY FIXED INCOME BRL,FFMM-ADMINISTRADORA-8661,mutual_fund,,4,8661-4,http://www.cmfchile.cl
2584,conceptual_asset,FONDO MUTUO SECURITY FUNDACION,FFMM-ADMINISTRADORA-8262,mutual_fund,,4,8262-7,http://www.cmfchile.cl
2585,conceptual_asset,FONDO MUTUO SECURITY GLOBAL INVESTMENT,FFMM-ADMINISTRADORA-8095,mutual_fund,,4,8095-0,http://www.cmfchile.cl
2586,conceptual_asset,FONDO MUTUO SECURITY INDEX FUND CHILE MID & SMALL CAP,FFMM-ADMINISTRADORA-8814,mutual_fund,,4,8814-5,http://www.cmfchile.cl
2587,conceptual_asset,FONDO MUTUO SECURITY LATINOAMERICANO,FFMM-ADMINISTRADORA-8567,mutual_fund,,4,8567-7,http://www.cmfchile.cl
2588,conceptual_asset,FONDO MUTUO SECURITY LATINOAMÉRICA,FFMM-ADMINISTRADORA-8486,mutual_fund,,4,8486-7,http://www.cmfchile.cl
2594,conceptual_asset,FONDO MUTUO SECURITY NOMINAL,FFMM-ADMINISTRADORA-8491,mutual_fund,,4,8491-3,http://www.cmfchile.cl
2595,conceptual_asset,FONDO MUTUO SECURITY OPPORTUNITY 105 GARANTIZADO II,FFMM-ADMINISTRADORA-8444,mutual_fund,,4,8444-1,http://www.cmfchile.cl
2596,conceptual_asset,FONDO MUTUO SECURITY PREMIUM,FFMM-ADMINISTRADORA-8359,mutual_fund,,4,8359-3,http://www.cmfchile.cl
2178,conceptual_asset,FONDO MUTUO BCI ESTRUCTURADO 103,FFMM-BCI-9329,mutual_fund,,4,9329-7,http://www.cmfchile.cl
2180,conceptual_asset,FONDO MUTUO BCI ESTRUCTURADO 108 IV,FFMM-BCI-9399,mutual_fund,,4,9399-8,http://www.cmfchile.cl
2181,conceptual_asset,FONDO MUTUO BCI EUROPA GARANTIZADO,FFMM-BCI-8942,mutual_fund,,4,8942-7,http://www.cmfchile.cl
2166,conceptual_asset,FONDO MUTUO BCI BRIC 40,FFMM-BCI-8581,mutual_fund,,4,8581-2,http://www.cmfchile.cl
2167,conceptual_asset,FONDO MUTUO BCI CAPITAL TRUST 100,FFMM-BCI-8334,mutual_fund,,4,8334-8,http://www.cmfchile.cl
2171,conceptual_asset,FONDO MUTUO BCI CAPITAL TRUST MARCOPOLO,FFMM-BCI-8478,mutual_fund,,4,8478-6,http://www.cmfchile.cl
2214,conceptual_asset,FONDO MUTUO BOOSTER ACCIONES EMERGENTE,FFMM-BANCHILE-9447,mutual_fund,CLP,4,9447-1,http://www.cmfchile.cl
1721,conceptual_asset,FONDO MUTUO BOOSTER ACCIONES EMERGENTES II,FFMM-BANCHILE-9519,mutual_fund,CLP,4,9519-2,http://www.cmfchile.cl
2217,conceptual_asset,FONDO MUTUO BOOSTER ACCIONES EUROPA II,FFMM-BANCHILE-9487,mutual_fund,CLP,4,9487-0,http://www.cmfchile.cl
2597,conceptual_asset,FONDO MUTUO SECURITY PREMIUM,FFMM-ADMINISTRADORA-8065,mutual_fund,,4,8065-9,http://www.cmfchile.cl
2598,conceptual_asset,FONDO MUTUO SECURITY PREVISION,FFMM-ADMINISTRADORA-8258,mutual_fund,,4,8258-9,http://www.cmfchile.cl
2599,conceptual_asset,FONDO MUTUO SECURITY PROTECCION UF,FFMM-ADMINISTRADORA-8790,mutual_fund,,4,8790-4,http://www.cmfchile.cl
2600,conceptual_asset,FONDO MUTUO SECURITY RENTA DÓLAR,FFMM-ADMINISTRADORA-8493,mutual_fund,,4,8493-k,http://www.cmfchile.cl
2601,conceptual_asset,FONDO MUTUO SECURITY RENTA INTERNACIONAL,FFMM-ADMINISTRADORA-8409,mutual_fund,,4,8409-3,http://www.cmfchile.cl
2602,conceptual_asset,FONDO MUTUO SECURITY RENTA LOCAL MEDIANO PLAZO,FFMM-ADMINISTRADORA-8313,mutual_fund,,4,8313-5,http://www.cmfchile.cl
2603,conceptual_asset,FONDO MUTUO SECURITY U.S.A.,FFMM-ADMINISTRADORA-8360,mutual_fund,,4,8360-7,http://www.cmfchile.cl
2604,conceptual_asset,FONDO MUTUO SECURITY USA,FFMM-ADMINISTRADORA-8425,mutual_fund,,4,8425-5,http://www.cmfchile.cl
