id,type,name,symbol,category,currency,max_scale,run,data_source
25,conceptual_asset,Dólar Observado,USDCLP,currency,CLP,4,,https://www.bcentral.cl
1679,conceptual_asset,FONDO MUTUO BCI RENDIMIENTO,FFMM-BCI-8036,mutual_fund,CLP,4,8036-5,http://www.cmfchile.cl
2826,conceptual_asset,GLD,GLD,etf,USD,4,,
1670,conceptual_asset,FONDO MUTUO BCI ESTRATEGIA UF > 5 AÑOS,FFMM-BCI-8460,mutual_fund,CLP,4,8460-3,http://www.cmfchile.cl
2642,conceptual_asset,FONDO MUTUO BICE ESTRUCTURADO 108,FFMM-BICE-9728,mutual_fund,CLP,4,9728-4,http://www.cmfchile.cl
2892,conceptual_asset,FONDO MUTUO ITAU COMPASS ACCIONES LATINOAMERICANAS,FFMM-ITAU-9926,mutual_fund,,4,9926-0,http://www.cmfchile.cl
1774,conceptual_asset,FONDO MUTUO CREDICORP CAPITAL INDICE CHILE,FFMM-CREDICORP-8929,mutual_fund,,4,8929-k,http://www.cmfchile.cl
2889,conceptual_asset,FONDO DE INVERSIÓN TRONADOR DEUDA PRIVADA,FINV-9918,investment_fund,,4,9918-k,http://www.cmfchile.cl
2898,conceptual_asset,XLC Deuda Privada Fintech Fondo de Inversión,FINV-9907,investment_fund,CLP,4,9907-4,http://www.cmfchile.cl
2887,conceptual_asset,FONDO MUTUO ITAU COMPASS DEUDA CHILENA,FFMM-ITAU-9927,mutual_fund,,4,9927-9,http://www.cmfchile.cl
2893,conceptual_asset,FONDO MUTUO ITAU DEUDA EMERGENTE,FFMM-ITAU-9923,mutual_fund,,4,9923-6,http://www.cmfchile.cl
2646,conceptual_asset,BICE DEUDA LATAM HY FONDO DE INVERSION,FINV-9734,investment_fund,,4,9734-9,http://www.cmfchile.cl
1844,conceptual_asset,FONDO MUTUO ITAU GESTIONADO AGRESIVO,FFMM-ITAU-8993,mutual_fund,CLP,4,8993-1,http://www.cmfchile.cl
2881,conceptual_asset,QUEST DEUDA CHILE INVESTMENT GRADE FONDO DE INVERSION,FINV-9885,investment_fund,,4,9885-k,http://www.cmfchile.cl
3051,conceptual_asset,FONDO DE INVERSION BANCHILE DEUDA DOLAR CORTO PLAZO,FINV-10120,investment_fund,,4,10120-6,http://www.cmfchile.cl
16,conceptual_asset,CLF/CLP,CLFCLP,currency,CLP,4,,https://www.bcentral.cl
1543,conceptual_asset,FONDO DE INVERSIÓN SANTANDER DEUDA LATAM,FINV-9666,investment_fund,,4,9666-0,http://www.cmfchile.cl
1847,conceptual_asset,FONDO MUTUO ITAU LATAM CORPORATE,FFMM-ITAU-8254,mutual_fund,USD,4,8254-6,http://www.cmfchile.cl
1841,conceptual_asset,FONDO MUTUO ITAU DINAMICO,FFMM-ITAU-8959,mutual_fund,CLP,4,8959-1,http://www.cmfchile.cl
2888,conceptual_asset,FONDO MUTUO ITAU LARRAINVIAL AHORRO ESTRATEGICO,FFMM-ITAU-9928,mutual_fund,,4,9928-7,http://www.cmfchile.cl
2842,conceptual_asset,ARKK,ARKK,etf,USD,4,,
2846,conceptual_asset,VCIT,VCIT,etf,USD,4,,
2894,conceptual_asset,FONDO MUTUO ITAÚ INCOME,FFMM-ITAU-9921,mutual_fund,,4,9921-k,http://www.cmfchile.cl
2973,conceptual_asset,VGT,VGT,etf,USD,4,,
1843,conceptual_asset,FONDO MUTUO ITAU GESTIONADO ACCIONES,FFMM-ITAU-8971,mutual_fund,CLP,4,8971-0,http://www.cmfchile.cl
2895,conceptual_asset,FONDO MUTUO BICE RENTA MÁS LARGO PLAZO,FFMM-BICE-9934,mutual_fund,,4,9934-1,http://www.cmfchile.cl
47,conceptual_asset,SPY,SPY,etf,USD,4,,
1520,conceptual_asset,FONDO DE INVERSIÓN ZURICH AHORRO DINÁMICO,FINV-9276,investment_fund,,4,9276-2,http://www.cmfchile.cl
1462,conceptual_asset,AMERIS DVA ALL CAP CHILE FONDO DE INVERSION,FINV-9395,investment_fund,,4,9395-5,http://www.cmfchile.cl
3053,conceptual_asset,FONDO MUTUO CLEVER DNA SCIENCE,FFMM-BICE-10130,mutual_fund,,4,10130-3,http://www.cmfchile.cl
2825,conceptual_asset,BLV,BLV,etf,USD,4,,
2848,conceptual_asset,FTEC,FTEC,etf,USD,4,,
1519,conceptual_asset,FONDO DE INVERSIÓN ZURICH RENTA VARIABLE GLOBAL,FINV-9198,investment_fund,,4,9198-7,http://www.cmfchile.cl
2902,conceptual_asset,FRONTAL TRUST RENDIMIENTO CON LIQUIDEZ FONDO DE INVERSIÓN,FINV-9917,investment_fund,CLP,4,9917-1,http://www.cmfchile.cl
2900,conceptual_asset,COMPASS GLOBAL TRENDS FONDO DE INVERSIÓN,FINV-9930,investment_fund,,4,9930-9,http://www.cmfchile.cl
2899,conceptual_asset,FONDO MUTUO ITAU TOESCA CHILE EQUITIES,FFMM-ITAU-9936,mutual_fund,,4,9936-8,http://www.cmfchile.cl
2847,conceptual_asset,FONDO DE INVERSIÓN WEG-7,FINV-9891,investment_fund,,4,9891-4,http://www.cmfchile.cl
2901,conceptual_asset,FONDO DE INVERSIÓN LARRAINVIAL HEALTH AND BIOTECH,FINV-9915,investment_fund,,4,9915-5,http://www.cmfchile.cl
3052,conceptual_asset,FONDO MUTUO BICE RENTA GLOBAL,FFMM-BICE-10139,mutual_fund,,4,10139-7,http://www.cmfchile.cl
3054,conceptual_asset,FONDO MUTUO CLEVER GLOBAL FINTECH,FFMM-BICE-10132,mutual_fund,,4,10132-k,http://www.cmfchile.cl
2784,conceptual_asset,Franklin Templeton Deuda Corto Plazo,FT-LIQU,investment_fund,MXN,6,,
2745,conceptual_asset,VT,VT,etf,USD,4,,
2827,conceptual_asset,FYNSA RENTA FIJA PRIVADA PERÚ,FINV-9461,investment_fund,USD,4,9641-5,http://www.cmfchile.cl
1678,conceptual_asset,FONDO MUTUO BCI CARTERA PATRIMONIAL CONSERVADORA,FFMM-BCI-9063,mutual_fund,CLP,4,9063-8,http://www.cmfchile.cl
2903,conceptual_asset,FONDO MUTUO LARRAINVIAL AHORRO LARGO PLAZO,FFMM-LARRAINVIAL-9929,mutual_fund,,4,9929-5,http://www.cmfchile.cl
2843,conceptual_asset,ARKW,ARKW,etf,USD,4,,
1661,conceptual_asset,FONDO MUTUO BCI FRONTERA,FFMM-BCI-8588,mutual_fund,CLP,4,8588-k,http://www.cmfchile.cl
1650,conceptual_asset,FONDO MUTUO BCI EMERGENTE GLOBAL,FFMM-BCI-8625,mutual_fund,CLP,4,8625-8,http://www.cmfchile.cl
2974,conceptual_asset,CLOU,CLOU,etf,USD,4,,
1672,conceptual_asset,FONDO MUTUO BCI DEUDA LATAM HY,FFMM-BCI-8967,mutual_fund,USD,4,8967-2,http://www.cmfchile.cl
1669,conceptual_asset,FONDO MUTUO BCI GLOBAL TITAN,FFMM-BCI-8710,mutual_fund,CLP,4,8710-6,http://www.cmfchile.cl
1664,conceptual_asset,FONDO MUTUO BCI GESTIÓN FLEXIBLE,FFMM-BCI-8813,mutual_fund,CLP,4,8813-7,http://www.cmfchile.cl
2896,conceptual_asset,FONDO MUTUO ITAU GLOBAL BRANDS,FFMM-ITAU-9931,mutual_fund,,4,9931-7,http://www.cmfchile.cl
1641,conceptual_asset,FONDO MUTUO BCI DEUDA LATAM IG,FFMM-BCI-9231,mutual_fund,USD,4,9231-2,http://www.cmfchile.cl
1683,conceptual_asset,FONDO MUTUO BCI USA,FFMM-BCI-8515,mutual_fund,USD,4,8515-4,http://www.cmfchile.cl
3055,conceptual_asset,FONDO MUTUO CLEVER VIDEO GAMES & ESPORTS,FFMM-BICE-10131,mutual_fund,,4,10131-1,http://www.cmfchile.cl
1642,conceptual_asset,FONDO MUTUO BCI ESTRATEGIA UF HASTA 1 AÑO,FFMM-BCI-8941,mutual_fund,CLP,4,8941-9,http://www.cmfchile.cl
1488,conceptual_asset,FONDO MUTUO CREDICORP CAPITAL MACRO 2.0,FFMM-CREDICORP-9107,mutual_fund,,4,9107-3,http://www.cmfchile.cl
1493,conceptual_asset,FONDO DE INVERSION ITAU ACCIONARIO GLOBAL,FINV-9550,investment_fund,,4,9550-8,http://www.cmfchile.cl
2891,conceptual_asset,FONDO MUTUO ITAU ACCIONES EMERGENTES,FFMM-ITAU-9922,mutual_fund,,4,9922-8,http://www.cmfchile.cl
2897,conceptual_asset,FONDO MUTUO ITAU US ADVANTAGE,FFMM-ITAU-9932,mutual_fund,,4,9932-5,http://www.cmfchile.cl
2975,conceptual_asset,FONDO DE INVERSIÓN LARRAINVIAL BROWN ADVISORY US SUSTAINABLE GROWTH,FINV-9997,investment_fund,,4,9997-k,http://www.cmfchile.cl
2179,conceptual_asset,FONDO MUTUO BCI ESTRUCTURADO 108 III,FFMM-BCI-9262,mutual_fund,CLP,4,9262-2,http://www.cmfchile.cl
2841,conceptual_asset,FONDO DE INVERSION BANCHILE GLOBAL REAL ESTATE,FINV-9854,investment_fund,,4,9854-k,http://www.cmfchile.cl
1715,conceptual_asset,FONDO MUTUO BICE RENTA PESOS,FFMM-BICE-8029,mutual_fund,CLP,4,8029-2,http://www.cmfchile.cl
1675,conceptual_asset,FONDO MUTUO BCI CARTERA PATRIMONIAL ACTIVA,FFMM-BCI-9060,mutual_fund,CLP,4,9060-3,http://www.cmfchile.cl
1676,conceptual_asset,FONDO MUTUO BCI CARTERA PATRIMONIAL AHORRO,FFMM-BCI-9061,mutual_fund,CLP,4,9061-1,http://www.cmfchile.cl
1696,conceptual_asset,FONDO MUTUO BICE ACCIONES INDIA,FFMM-BICE-9223,mutual_fund,CLP,4,9223-1,http://www.cmfchile.cl
2006,conceptual_asset,FONDO MUTUO SECURITY ASIA EMERGENTE,FFMM-ADMINISTRADORA-8820,mutual_fund,,4,8820-k,http://www.cmfchile.cl
2883,conceptual_asset,FONDO DE INVERSIÓN SURA DEUDA CORPORATIVA LATINOAMERICANA USD,FINV-9897,investment_fund,,4,9897-3,http://www.cmfchile.cl
2908,conceptual_asset,FONDO DE INVERSIÓN SARTOR TÁCTICO PERÚ,FINV-9882,investment_fund,,4,9882-5,http://www.cmfchile.cl
2010,conceptual_asset,FONDO MUTUO SECURITY DEUDA CORPORATIVA LATINOAMERICANA,FFMM-ADMINISTRADORA-8940,mutual_fund,,4,8940-0,http://www.cmfchile.cl
2747,conceptual_asset,ETHO,ETHO,etf,USD,4,,
2844,conceptual_asset,ESGU,ESGU,etf,USD,4,,
2016,conceptual_asset,FONDO MUTUO SECURITY EUROPA ESTRATÉGICO,FFMM-ADMINISTRADORA-9187,mutual_fund,,4,9187-1,http://www.cmfchile.cl
2024,conceptual_asset,FONDO MUTUO SECURITY LOCAL EMERGING DEBT,FFMM-ADMINISTRADORA-8823,mutual_fund,,4,8823-4,http://www.cmfchile.cl
1836,conceptual_asset,FONDO MUTUO ITAU AHORRO PLUS,FFMM-ITAU-9539,mutual_fund,CLP,4,9539-7,http://www.cmfchile.cl
2906,conceptual_asset,AMERIS DVA MEDTECH FUND FONDO DE INVERSIÓN,FINV-9937,investment_fund,,4,9937-6,http://www.cmfchile.cl
1849,conceptual_asset,FONDO MUTUO ITAU PERFORMANCE,FFMM-ITAU-8092,mutual_fund,CLP,4,8092-6,http://www.cmfchile.cl
2364,conceptual_asset,FONDO MUTUO ITAU CAPITAL BALANCEADO,FFMM-ITAU-9016,mutual_fund,,4,9016-6,http://www.cmfchile.cl
1494,conceptual_asset,FONDO DE INVERSION ITAU CHILE CORPORATIVO,FINV-9551,investment_fund,,4,9551-6,http://www.cmfchile.cl
2365,conceptual_asset,FONDO MUTUO ITAU CAPITAL MODERADO,FFMM-ITAU-9017,mutual_fund,,4,9017-4,http://www.cmfchile.cl
2369,conceptual_asset,FONDO MUTUO ITAU EUROPA,FFMM-ITAU-8269,mutual_fund,,4,8269-4,http://www.cmfchile.cl
2370,conceptual_asset,FONDO MUTUO ITAU GESTIONADO MODERADO,FFMM-ITAU-8928,mutual_fund,,4,8928-1,http://www.cmfchile.cl
2371,conceptual_asset,FONDO MUTUO ITAU INVESTMENT C,FFMM-ITAU-9014,mutual_fund,,4,9014-k,http://www.cmfchile.cl
2372,conceptual_asset,FONDO MUTUO ITAU INVESTMENT D,FFMM-ITAU-9015,mutual_fund,,4,9015-8,http://www.cmfchile.cl
2374,conceptual_asset,FONDO MUTUO ITAU MAS INGRESO,FFMM-ITAU-8590,mutual_fund,,4,8590-1,http://www.cmfchile.cl
2379,conceptual_asset,FONDO MUTUO ITAU PLUS,FFMM-ITAU-8235,mutual_fund,,4,8235-k,http://www.cmfchile.cl
2380,conceptual_asset,FONDO MUTUO ITAU RENTA ESTRATEGICA,FFMM-ITAU-9189,mutual_fund,,4,9189-8,http://www.cmfchile.cl
2381,conceptual_asset,FONDO MUTUO ITAU SELECCION NACIONAL,FFMM-ITAU-8030,mutual_fund,,4,8030-6,http://www.cmfchile.cl
2390,conceptual_asset,FONDO MUTUO ITAÚ GESTIONADO DEUDA LOCAL,FFMM-ITAU-8265,mutual_fund,,4,8265-1,http://www.cmfchile.cl
2391,conceptual_asset,FONDO MUTUO ITAÚ GESTIONADO MUY CONSERVADOR,FFMM-ITAU-8926,mutual_fund,,4,8926-5,http://www.cmfchile.cl
2392,conceptual_asset,FONDO MUTUO ITAÚ LATAM PACIFIC,FFMM-ITAU-8891,mutual_fund,,4,8891-9,http://www.cmfchile.cl
2393,conceptual_asset,FONDO MUTUO ITAÚ MIX,FFMM-ITAU-8290,mutual_fund,,4,8290-2,http://www.cmfchile.cl
2394,conceptual_asset,FONDO MUTUO ITAÚ SELECCIÓN BRASIL,FFMM-ITAU-8519,mutual_fund,,4,8519-7,http://www.cmfchile.cl
2395,conceptual_asset,FONDO MUTUO ITAÚ SMALL & MID CAP BRASIL,FFMM-ITAU-8520,mutual_fund,,4,8520-0,http://www.cmfchile.cl
2396,conceptual_asset,FONDO MUTUO ITAÚ WORLD EQUITY,FFMM-ITAU-8237,mutual_fund,,4,8237-6,http://www.cmfchile.cl
2907,conceptual_asset,FONDO DE INVERSION BANCHILE EQUITY TRENDS,FINV-9933,investment_fund,,4,9933-3,http://www.cmfchile.cl
2909,conceptual_asset,FONDO MUTUO AUTOCALL DOLLAR COUPON USA,FFMM-BANCHILE-9947,mutual_fund,,4,9947-3,http://www.cmfchile.cl
1525,conceptual_asset,FONDO DE INVERSIÓN FYNSA DEUDA CHILE,FINV-9559,investment_fund,,4,9559-1,http://www.cmfchile.cl
2910,conceptual_asset,FONDO MUTUO BEST COUPON EMERGENTE,FFMM-BANCHILE-9946,mutual_fund,,4,9946-5,http://www.cmfchile.cl
1850,conceptual_asset,FONDO MUTUO ITAU SELECT,FFMM-ITAU-8338,mutual_fund,CLP,4,8338-0,http://www.cmfchile.cl
2002,conceptual_asset,FONDO MUTUO SCOTIA ACCIONES USA,FFMM-SCOTIA-8480,mutual_fund,CLP,4,8480-8,http://www.cmfchile.cl
2911,conceptual_asset,FONDO MUTUO ITAU MONEDA CREDITO LATAM,FFMM-ITAU-9935,mutual_fund,,4,9935-k,http://www.cmfchile.cl
2912,conceptual_asset,FONDO DE INVERSIÓN ACTIVA DEUDA AUTOMOTRIZ PERÚ,FINV-9703,investment_fund,,4,9703-9,http://www.cmfchile.cl
2977,conceptual_asset,BTG PACTUAL GLOBAL BDCS FONDO DE INVERSIÓN,FINV-10039,investment_fund,,4,10039-0,http://www.cmfchile.cl
2976,conceptual_asset,Schroders International Selection Fund China A,LU1713307699,mutual_fund,USD,4,,
2904,conceptual_asset,Risky Hayek,+HAYEK+,investment_fund,MXN,4,,
2009,conceptual_asset,FONDO MUTUO SECURITY CRECIMIENTO ESTRATEGICO,FFMM-ADMINISTRADORA-8492,mutual_fund,CLP,4,8492-1,http://www.cmfchile.cl
2913,conceptual_asset,FONDO DE INVERSIÓN ACTIVA FINANCIAMIENTO ESTRUCTURADO PERU,FINV-9710,investment_fund,,4,9710-1,http://www.cmfchile.cl
2305,conceptual_asset,FONDO MUTUO DEUDA ESTATAL,FFMM-BANCHILE-8102,mutual_fund,CLP,4,8102-7,http://www.cmfchile.cl
2306,conceptual_asset,FONDO MUTUO DEUDA ESTATAL PESOS 2-4 AÑOS,FFMM-BANCHILE-8275,mutual_fund,CLP,4,8275-9,http://www.cmfchile.cl
2308,conceptual_asset,FONDO MUTUO DEUDA PESOS 1-5 AÑOS,FFMM-BANCHILE-8134,mutual_fund,CLP,4,8134-5,http://www.cmfchile.cl
1886,conceptual_asset,FONDO MUTUO BANCHILE PORTAFOLIO ACTIVO EQUILIBRADO,FFMM-BANCHILE-9043,mutual_fund,CLP,4,9043-3,http://www.cmfchile.cl
1887,conceptual_asset,FONDO MUTUO BANCHILE PORTAFOLIO ACTIVO MODERADO,FFMM-BANCHILE-9067,mutual_fund,CLP,4,9067-0,http://www.cmfchile.cl
1552,conceptual_asset,FONDO DE INVERSION SURA ACCIONES EUROPEAS EN LIQUIDACION,FINV-9493,investment_fund,,4,9493-5,http://www.cmfchile.cl
1888,conceptual_asset,FONDO MUTUO BANCHILE PORTAFOLIO ACTIVO POTENCIADO,FFMM-BANCHILE-8448,mutual_fund,CLP,4,8448-4,http://www.cmfchile.cl
1917,conceptual_asset,FONDO MUTUO BANCHILE QUANT GLOBAL STRATEGY,FFMM-BANCHILE-9038,mutual_fund,CLP,4,9038-7,http://www.cmfchile.cl
1550,conceptual_asset,FONDO DE INVERSIÓN SURA ACCIONES EMERGENTES,FINV-9491,investment_fund,,4,9491-9,http://www.cmfchile.cl
1551,conceptual_asset,FONDO DE INVERSIÓN SURA ACCIONES ESTADOS UNIDOS,FINV-9492,investment_fund,,4,9492-7,http://www.cmfchile.cl
3056,conceptual_asset,FONDO DE INVERSION BANCHILE MARKETPLUS TECNOLOGIA,FINV-10116,investment_fund,,4,10116-8,http://www.cmfchile.cl
1918,conceptual_asset,FONDO MUTUO BANCHILE RENTA FUTURA,FFMM-BANCHILE-8357,mutual_fund,CLP,4,8357-7,http://www.cmfchile.cl
1719,conceptual_asset,FONDO MUTUO BOOSTER ACCIONES BRASIL,FFMM-BANCHILE-9585,mutual_fund,CLP,4,9585-0,http://www.cmfchile.cl
2905,conceptual_asset,Moderate Portman,PORTMAN,investment_fund,MXN,4,,
2028,conceptual_asset,FONDO MUTUO SECURITY PLUS,FFMM-ADMINISTRADORA-8253,mutual_fund,CLP,4,8253-8,http://www.cmfchile.cl
2033,conceptual_asset,FONDO MUTUO SOLVENTE BANCOESTADO,FFMM-BANCOESTADO-8319,mutual_fund,CLP,4,8319-4,http://www.cmfchile.cl
2003,conceptual_asset,FONDO MUTUO SCOTIA PORTAFOLIO MAS CONSERVADOR,FFMM-SCOTIA-8304,mutual_fund,CLP,4,8304-6,http://www.cmfchile.cl
2332,conceptual_asset,FONDO MUTUO GARANTIZADO SANTANDER EFICIENTE,FFMM-SANTANDER-8767,mutual_fund,,4,8767-k,http://www.cmfchile.cl
2453,conceptual_asset,FONDO MUTUO OHIGGINS CUENTA VISTA,FFMM-SANTANDER-8060,mutual_fund,,4,8060-8,http://www.cmfchile.cl
2492,conceptual_asset,FONDO MUTUO SANTANDER ACCIONES EUROPA DESARROLLADO,FFMM-SANTANDER-8158,mutual_fund,,4,8158-2,http://www.cmfchile.cl
2493,conceptual_asset,FONDO MUTUO SANTANDER ACCIONES EUROPA EMERGENTE,FFMM-SANTANDER-8179,mutual_fund,,4,8179-5,http://www.cmfchile.cl
2495,conceptual_asset,FONDO MUTUO SANTANDER ACCIONES SELECTAS BRASIL,FFMM-SANTANDER-8593,mutual_fund,,4,8593-6,http://www.cmfchile.cl
2497,conceptual_asset,FONDO MUTUO SANTANDER BONOS DOLAR,FFMM-SANTANDER-8231,mutual_fund,,4,8231-7,http://www.cmfchile.cl
2498,conceptual_asset,FONDO MUTUO SANTANDER CIRCULANTE,FFMM-SANTANDER-8083,mutual_fund,,4,8083-7,http://www.cmfchile.cl
2845,conceptual_asset,SMH,SMH,etf,USD,4,,
1629,conceptual_asset,FONDO MUTUO BANCOESTADO RENTA FUTURA,FFMM-BANCOESTADO-9074,mutual_fund,CLP,4,9074-3,http://www.cmfchile.cl
1643,conceptual_asset,FONDO MUTUO BCI ESTRATEGIA UF HASTA 3 AÑOS,FFMM-BCI-8064,mutual_fund,CLP,4,8064-0,http://www.cmfchile.cl
1639,conceptual_asset,FONDO MUTUO BCI ESTRATEGIA PESOS HASTA 1 AÑO,FFMM-BCI-8327,mutual_fund,CLP,4,8327-5,http://www.cmfchile.cl
1633,conceptual_asset,FONDO MUTUO BCI AMERICA LATINA,FFMM-BCI-8434,mutual_fund,CLP,4,8434-4,http://www.cmfchile.cl
1659,conceptual_asset,FONDO MUTUO BCI EUROPA,FFMM-BCI-8513,mutual_fund,CLP,4,8513-8,http://www.cmfchile.cl
2917,conceptual_asset,FONDO MUTUO BCI ESTRATEGIA DEUDA CALIFICADOS,FFMM-BCI-9981,mutual_fund,,4,9981-3,http://www.cmfchile.cl
1636,conceptual_asset,FONDO MUTUO BCI CHINDIA,FFMM-BCI-8777,mutual_fund,CLP,4,8777-7,http://www.cmfchile.cl
2203,conceptual_asset,FONDO MUTUO BCI SELECCION ANDINA,FFMM-BCI-8870,mutual_fund,CLP,4,8870-6,http://www.cmfchile.cl
2200,conceptual_asset,FONDO MUTUO BCI MERCADOS DESARROLLADOS GARANTIZADO,FFMM-BCI-9066,mutual_fund,CLP,4,9066-2,http://www.cmfchile.cl
2190,conceptual_asset,FONDO MUTUO BCI GARANTIZADO DEPÓSITO 110,FFMM-BCI-9200,mutual_fund,CLP,4,9200-2,http://www.cmfchile.cl
2182,conceptual_asset,FONDO MUTUO BCI EUROPA GARANTIZADO II,FFMM-BCI-9197,mutual_fund,CLP,4,9197-9,http://www.cmfchile.cl
1673,conceptual_asset,FONDO MUTUO BCI PB STRATEGY DEBT,FFMM-BCI-9226,mutual_fund,CLP,4,9226-6,http://www.cmfchile.cl
1662,conceptual_asset,FONDO MUTUO BCI CARTERA DINAMICA CORTO PLAZO,FFMM-BCI-8731,mutual_fund,CLP,4,8731-9,http://www.cmfchile.cl
1690,conceptual_asset,FONDO MUTUO BICE ACCIONES CHILE,FFMM-BICE-8046,mutual_fund,CLP,4,8046-2,http://www.cmfchile.cl
2914,conceptual_asset,FONDO DE INVERSIÓN FALCOM LATAM USD DEBT ESG,FINV-9912,investment_fund,,4,9912-0,http://www.cmfchile.cl
2916,conceptual_asset,MBI GLOBAL FIXED INCOME FONDO DE INVERSION,FINV-9950,investment_fund,,4,9950-3,http://www.cmfchile.cl
2915,conceptual_asset,FONDO MUTUO BCI ESTRUCTURADO AHORRO 3,FFMM-BCI-9961,mutual_fund,,4,9961-9,http://www.cmfchile.cl
2884,conceptual_asset,FONDO DE INVERSIÓN HMC DEUDA PRIVADA GLOBAL,FINV-9914,investment_fund,,4,9914-7,http://www.cmfchile.cl
2920,conceptual_asset,FONDO MUTUO AGRESIVO,FFMM-BICE-9964,mutual_fund,,4,9964-3,http://www.cmfchile.cl
2979,conceptual_asset,FONDO DE INVERSION AZIMUT FUTURE OPPORTUNITIES,FINV-10095,investment_fund,,4,10095-1,http://www.cmfchile.cl
1667,conceptual_asset,FONDO MUTUO BCI CARTERA DINAMICA ACTIVA,FFMM-BCI-8640,mutual_fund,CLP,4,8640-1,http://www.cmfchile.cl
2978,conceptual_asset,Frontal Trust Xepelin Deuda México Fondo de Inversión,FINV-10062,investment_fund,USD,4,10062-5,http://www.cmfchile.cl
1668,conceptual_asset,FONDO MUTUO BCI CARTERA DINÁMICA AHORRO,FFMM-BCI-9228,mutual_fund,CLP,4,9228-2,http://www.cmfchile.cl
1647,conceptual_asset,FONDO MUTUO BCI DOLAR CASH,FFMM-BCI-8257,mutual_fund,USD,4,8257-0,http://www.cmfchile.cl
2918,conceptual_asset,FONDO DE INVERSIÓN ETF SINGULAR GLOBAL CORPORATES,FINV-9948,investment_fund,,4,9948-1,http://www.cmfchile.cl
2499,conceptual_asset,FONDO MUTUO SANTANDER DE RESERVA,FFMM-SANTANDER-8072,mutual_fund,,4,8072-1,http://www.cmfchile.cl
2500,conceptual_asset,FONDO MUTUO SANTANDER EFICIENTE,FFMM-SANTANDER-8989,mutual_fund,,4,8989-3,http://www.cmfchile.cl
2501,conceptual_asset,FONDO MUTUO SANTANDER ESTADOS UNIDOS,FFMM-SANTANDER-8180,mutual_fund,,4,8180-9,http://www.cmfchile.cl
2502,conceptual_asset,FONDO MUTUO SANTANDER EURO,FFMM-SANTANDER-8267,mutual_fund,,4,8267-8,http://www.cmfchile.cl
2503,conceptual_asset,FONDO MUTUO SANTANDER GARANTIZADO 110,FFMM-SANTANDER-8273,mutual_fund,,4,8273-2,http://www.cmfchile.cl
2504,conceptual_asset,FONDO MUTUO SANTANDER GARANTIZADO 110,FFMM-SANTANDER-8501,mutual_fund,,4,8501-4,http://www.cmfchile.cl
2505,conceptual_asset,FONDO MUTUO SANTANDER GARANTIZADO CARIOCA,FFMM-SANTANDER-8598,mutual_fund,,4,8598-7,http://www.cmfchile.cl
2882,conceptual_asset,FONDO MUTUO BI ESTRATÉGICO,FFMM-BANCO-9905,mutual_fund,,4,9905-8,http://www.cmfchile.cl
2506,conceptual_asset,FONDO MUTUO SANTANDER GARANTIZADO CHILE,FFMM-SANTANDER-8511,mutual_fund,,4,8511-1,http://www.cmfchile.cl
2507,conceptual_asset,FONDO MUTUO SANTANDER GARANTIZADO EN VERDES,FFMM-SANTANDER-8443,mutual_fund,,4,8443-3,http://www.cmfchile.cl
2508,conceptual_asset,FONDO MUTUO SANTANDER GARANTIZADO EXTRA,FFMM-SANTANDER-8293,mutual_fund,,4,8293-7,http://www.cmfchile.cl
2509,conceptual_asset,FONDO MUTUO SANTANDER GARANTIZADO MANDARIN,FFMM-SANTANDER-8628,mutual_fund,,4,8628-2,http://www.cmfchile.cl
2786,conceptual_asset,FONDO DE INVERSIÓN HMC BALANCEADO GLOBAL,FINV-9865,investment_fund,,4,9865-5,http://www.cmfchile.cl
2956,conceptual_asset,CXSE,CXSE,etf,USD,4,,
1473,conceptual_asset,BTG PACTUAL DEUDA LATINOAMERICANA FONDO DE INVERSION,FINV-7141,investment_fund,,4,7141-2,http://www.cmfchile.cl
2885,conceptual_asset,BTG PACTUAL GLOBAL REITS FONDO DE INVERSIÓN,FINV-9910,investment_fund,,4,9910-4,http://www.cmfchile.cl
2237,conceptual_asset,FONDO MUTUO BTG PACTUAL ACCIONES EUROPA EMERGENTE,FFMM-BTG-8728,mutual_fund,,4,8728-9,http://www.cmfchile.cl
59,conceptual_asset,VEU,VEU,etf,USD,4,,
2238,conceptual_asset,FONDO MUTUO BTG PACTUAL ANDINO,FFMM-BTG-9000,mutual_fund,,4,9000-k,http://www.cmfchile.cl
1497,conceptual_asset,FONDO DE INVERSION NEVASA RENTA FIJA LOCAL,FINV-9101,investment_fund,,4,9101-4,http://www.cmfchile.cl
1648,conceptual_asset,FONDO MUTUO BCI CARTERA PATRIMONIAL CORTO PLAZO,FFMM-BCI-8976,mutual_fund,CLP,4,8976-1,http://www.cmfchile.cl
2921,conceptual_asset,AMERIS DVA DEUDA PRIVADA USA FONDO DE INVERSIÓN,FINV-9958,investment_fund,,4,9958-9,http://www.cmfchile.cl
1665,conceptual_asset,FONDO MUTUO BCI CARTERA DINÁMICA CONSERVADORA,FFMM-BCI-8638,mutual_fund,CLP,4,8638-k,http://www.cmfchile.cl
2244,conceptual_asset,FONDO MUTUO CELFIN ACCIONES ASIA DESARROLLADA,FFMM-BTG-8596,mutual_fund,,4,8596-0,http://www.cmfchile.cl
2955,conceptual_asset,ARRAYÁN ACCIONES CHILENAS FONDO DE INVERSIÓN,FINV-9989,investment_fund,,4,9989-9,http://www.cmfchile.cl
1635,conceptual_asset,FONDO MUTUO BCI BONOS LATINOAMERICANOS,FFMM-BCI-8970,mutual_fund,CLP,4,8970-2,http://www.cmfchile.cl
1666,conceptual_asset,FONDO MUTUO BCI CARTERA DINÁMICA BALANCEADA,FFMM-BCI-8639,mutual_fund,CLP,4,8639-8,http://www.cmfchile.cl
1474,conceptual_asset,BTG PACTUAL ESTADOS UNIDOS FONDO DE INVERSIÓN,FINV-9527,investment_fund,,4,9527-3,http://www.cmfchile.cl
2245,conceptual_asset,FONDO MUTUO CELFIN ACCIONES EUROPEAS,FFMM-BTG-8374,mutual_fund,,4,8374-7,http://www.cmfchile.cl
2246,conceptual_asset,FONDO MUTUO CELFIN DINAMICO ACCIONARIO,FFMM-BTG-8445,mutual_fund,,4,8445-k,http://www.cmfchile.cl
2247,conceptual_asset,FONDO MUTUO CELFIN DINAMICO BALANCEADO,FFMM-BTG-8446,mutual_fund,,4,8446-8,http://www.cmfchile.cl
2248,conceptual_asset,FONDO MUTUO CELFIN DINAMICO CONSERVADOR,FFMM-BTG-8410,mutual_fund,,4,8410-7,http://www.cmfchile.cl
1475,conceptual_asset,BTG PACTUAL LATAM INVESTMENT GRADE FONDO DE INVERSION,FINV-9360,investment_fund,,4,9360-2,http://www.cmfchile.cl
1476,conceptual_asset,BTG PACTUAL T. ROWE PRICE FLEXIBLE EMERGING MARKET DEBT FONDO DE INVERSIÓN,FINV-9677,investment_fund,,4,9677-6,http://www.cmfchile.cl
1688,conceptual_asset,FONDO MUTUO BICE ACCIONES ASIA,FFMM-BICE-8178,mutual_fund,CLP,4,8178-7,http://www.cmfchile.cl
1695,conceptual_asset,FONDO MUTUO BICE ACCIONES EUROPA,FFMM-BICE-8114,mutual_fund,CLP,4,8114-0,http://www.cmfchile.cl
1699,conceptual_asset,FONDO MUTUO BICE ACCIONES MERCADOS EMERGENTES,FFMM-BICE-8475,mutual_fund,CLP,4,8475-1,http://www.cmfchile.cl
1702,conceptual_asset,FONDO MUTUO BICE ACCIONES NORTEAMERICA,FFMM-BICE-8183,mutual_fund,CLP,4,8183-3,http://www.cmfchile.cl
1704,conceptual_asset,FONDO MUTUO BICE BONOS LATAM,FFMM-BICE-8750,mutual_fund,USD,4,8750-5,http://www.cmfchile.cl
1689,conceptual_asset,FONDO MUTUO BICE ACCIONES BRASIL,FFMM-BICE-8725,mutual_fund,CLP,4,8725-4,http://www.cmfchile.cl
1694,conceptual_asset,FONDO MUTUO BICE ACCIONES COLOMBIA,FFMM-BICE-8935,mutual_fund,CLP,4,8935-4,http://www.cmfchile.cl
1705,conceptual_asset,FONDO MUTUO BICE COMMODITIES,FFMM-BICE-8749,mutual_fund,CLP,4,8749-1,http://www.cmfchile.cl
1709,conceptual_asset,FONDO MUTUO BICE ESTRATEGIA MÁS AGRESIVA,FFMM-BICE-8785,mutual_fund,CLP,4,8785-8,http://www.cmfchile.cl
1706,conceptual_asset,FONDO MUTUO BICE ESTRATEGIA AGRESIVA,FFMM-BICE-8687,mutual_fund,CLP,4,8687-8,http://www.cmfchile.cl
2980,conceptual_asset,FONDO DE INVERSION SURA DEUDA PRIVADA CHILE,FINV-9977,investment_fund,,4,9977-5,http://www.cmfchile.cl
1649,conceptual_asset,FONDO MUTUO BCI EFICIENTE,FFMM-BCI-8730,mutual_fund,CLP,4,8730-0,http://www.cmfchile.cl
3057,conceptual_asset,FONDO DE INVERSION ZURICH ACTIVOS ALTERNATIVOS,FINV-10128,investment_fund,,4,10128-1,http://www.cmfchile.cl
1613,conceptual_asset,VISION ROGGE GLOBAL INCOME FONDO DE INVERSION,FINV-9092,investment_fund,,4,9092-1,http://www.cmfchile.cl
1610,conceptual_asset,FONDO DE INVERSIÓN SURA DEUDA GLOBAL,FINV-9494,investment_fund,,4,9494-3,http://www.cmfchile.cl
1611,conceptual_asset,PENTA RETORNO LATINOAMERICA FONDO DE INVERSION,FINV-7261,investment_fund,,4,7261-3,http://www.cmfchile.cl
1697,conceptual_asset,FONDO MUTUO BICE ACCIONES JAPÓN,FFMM-BICE-9007,mutual_fund,CLP,4,9007-7,http://www.cmfchile.cl
1698,conceptual_asset,FONDO MUTUO BICE ACCIONES LATAM,FFMM-BICE-8537,mutual_fund,CLP,4,8537-5,http://www.cmfchile.cl
1718,conceptual_asset,FONDO MUTUO BICE TESORERIA,FFMM-BICE-8100,mutual_fund,CLP,4,8100-0,http://www.cmfchile.cl
1708,conceptual_asset,FONDO MUTUO BICE ESTRATEGIA CONSERVADORA,FFMM-BICE-8295,mutual_fund,CLP,4,8295-3,http://www.cmfchile.cl
1701,conceptual_asset,FONDO MUTUO BICE ACCIONES MÉXICO,FFMM-BICE-8801,mutual_fund,CLP,4,8801-3,http://www.cmfchile.cl
1703,conceptual_asset,FONDO MUTUO BICE ACCIONES PERÚ,FFMM-BICE-8937,mutual_fund,CLP,4,8937-0,http://www.cmfchile.cl
1707,conceptual_asset,FONDO MUTUO BICE ESTRATEGIA BALANCEADA,FFMM-BICE-8032,mutual_fund,CLP,4,8032-2,http://www.cmfchile.cl
1717,conceptual_asset,FONDO MUTUO BICE TENDENCIAS,FFMM-BICE-8944,mutual_fund,CLP,4,8944-3,http://www.cmfchile.cl
1693,conceptual_asset,FONDO MUTUO BICE ACCIONES CHILE SELECTIVO,FFMM-BICE-8142,mutual_fund,CLP,4,8142-6,http://www.cmfchile.cl
1728,conceptual_asset,FONDO MUTUO BTG PACTUAL ACCIONES USA,FFMM-BTG-8205,mutual_fund,CLP,4,8205-8,http://www.cmfchile.cl
2249,conceptual_asset,FONDO MUTUO CELFIN ENERGIA,FFMM-BTG-8426,mutual_fund,,4,8426-3,http://www.cmfchile.cl
1727,conceptual_asset,FONDO MUTUO BTG PACTUAL ACCIONES LATINOAMERICANAS,FFMM-BTG-8206,mutual_fund,CLP,4,8206-6,http://www.cmfchile.cl
